Comment,Aspect,Date,brand,trigger_keywords,model_score,lexicon_score,final_score
Account ඒක cancel කරන්න,Digital Banking Experience,2025-03-26T12:45:13Z,Commercial Bank,['commercial bank'],0.7249741554260254,0.0,0.5074819087982178
වැදගත් පනිවිඩයක් සහෝ.,Others,2025-03-26T12:27:12Z,Commercial Bank,['commercial bank'],0.6253765821456909,0.0,0.4377636075019836
Commercial bank එකේ වගකිව යුතු අය දකිත්වා,Trust and Security,2025-03-26T07:25:28Z,Commercial Bank,['commercial bank'],0.5853452086448669,0.0,0.40974164605140684
මාස 12ta ලක්ෂ 10 demmoth මාසෙට පොලිය ganna widiyata. Kiyak lebenwda?..,Transactions and Payments,2025-03-03T15:50:50Z,Commercial Bank,['commercial bank'],0.7076492309570312,0.0,0.49535446166992186
Mage current account ekak thiyenne eka fix ekakata change karganna puluwan da?,Digital Banking Experience,2025-03-03T15:46:39Z,Commercial Bank,['commercial bank'],0.810559093952179,0.0,0.5673913657665253
මාස O4  තැන්පතුවට  ලක්ශ 10ක් දැම්මොත් පොලිය කීයක්  ලැබෙනවද?,Transactions and Payments,2025-02-18T17:48:28Z,Commercial Bank,['commercial bank'],0.7530520558357239,0.0,0.5271364390850066
ලක්ෂ 65 ක් දින 100 ට දැම්මොත් පොළිය කීයද,Transactions and Payments,2025-02-17T15:15:15Z,Commercial Bank,['commercial bank'],0.763206422328949,0.0,0.5342444956302642
On line එකවුන්ට් එකක් ඕපන් කරන්නේ කොහොමද කියලා දෙන්න බැරිද?,Digital Banking Experience,2025-02-17T09:49:26Z,Commercial Bank,['commercial bank'],0.848301351070404,0.0,0.5938109457492828
ලක්ෂ 30ක් මාස 6කට ලැබෙන පොලිය කියද,Transactions and Payments,2025-02-17T02:38:23Z,Commercial Bank,['commercial bank'],0.731532633304596,0.0,0.5120728433132171
3 y bank ake ganudenu nokaroth account aka cansal wenawada,Digital Banking Experience,2025-05-16T10:05:45Z,Commercial Bank,['commercial bank'],0.7991587519645691,0.0,0.5594111263751983
aiye meka haduwoth paypal wage account ekakata card ekak pawichchi nokara salli ganna puluwanda,Transactions and Payments,2025-02-25T02:38:16Z,Commercial Bank,['commercial bank'],0.3350580632686615,1.0,0.534540644288063
commercial bank එකේ ස්ටේට්මන්ට් එක ගන්නෙ කොහොමද,Digital Banking Experience,2025-02-12T14:50:07Z,Commercial Bank,['commercial bank'],0.8301290273666382,0.0,0.5810903191566467
banking training යන්නත් digree එක්ක සම්පූර්ණ කරන්න ඕනද,Digital Banking Experience,2025-03-27T02:23:47Z,Commercial Bank,['commercial bank'],0.8233069777488708,0.0,0.5763148844242095
Ayye mata email ekak ewala thinava banking trainee exam ekata enna kiyala 30 wenidata combank headquarters ekata,Digital Banking Experience,2025-03-26T11:29:46Z,Commercial Bank,['commercial bank'],0.4089374244213104,0.0,0.2862561970949173
Aiye mata  commercial bank eke intaw call kara. Intaw ahana question monada,Customer Support,2025-03-26T05:15:34Z,Commercial Bank,['commercial bank'],0.8626424074172974,1.0,0.9038496851921081
