Comment,Aspect,Date,brand,trigger_keywords,model_score,lexicon_score,final_score
"Mata me january walata 22 labuwa 22 sampoorna nathi nisa apply krn puluwnd , a/l second shy eke result danna puluwnd natn 1 st shy eke result ek witrd dana puluwn",Trust and Security,2025-05-20T11:28:14Z,Commercial Bank,['commercial bank'],0.4124404788017273,0.0,0.2887083351612091
"Sir  ibsl eke course ek krn bank eke salary ekn fee gewn gmn krnn plwn d netnm api course ek krl  d job ekt ynn oni. ( mama okt apply kl, exm ekt liwwa)",Others,2025-05-20T07:36:35Z,Commercial Bank,['commercial bank'],0.04222707822918892,0.0,0.02955895476043224
"මට වයස 24යි මාස 10යි..වයස ප්‍රශ්නෙ නිසා ඇප්ලයි කරන්න බැහැ බෑන්ක් ජොබ්ස් වලට...2019 ඉදන් ඇප්ලයි කරා ඒත් බැරි උනා..ol english B, Maths B, Tamil A...Al cms walin ABC..general english C.. English higher national diploma eka karala inne..ජොබ්ස් වලට ඇප්ලයි කරන්නෙ 2019 ඉදල..තවම 25ක් වෙන්න ලන්වෙලත් ජොබ් එකක් නැ...මන් ඇප්ලයි කරන විදියෙ ප්‍රශ්නයක් ද වරදක් ද කියලත් හිතෙනව",Digital Banking Experience,2025-05-19T05:45:05Z,Commercial Bank,['commercial bank'],0.7515326738357544,0.0,0.526072871685028
Sir banking wlt awhsya smnya it apit free igen gnn widihk ndd 🥲🫠,Digital Banking Experience,2025-05-18T04:14:28Z,Commercial Bank,['commercial bank'],0.49273666739463806,0.0,0.3449156671762466
Mta  wayasa 24yi A/l bio kle css English it uk diploma dekk krl thiyenwa software engineering HND danata follow kranwa mt bank walt apply krnn puluwan d mt apply krnn puluwan job tikk kiynnko loku udwwak,Digital Banking Experience,2025-05-17T05:01:22Z,Commercial Bank,['commercial bank'],0.5378736257553101,0.0,0.376511538028717
මට O/l English C pass එකක් තියෙන්නෙ Apply කරන්න බැරි වෙයිද ?,Digital Banking Experience,2025-05-16T08:19:17Z,Commercial Bank,['commercial bank'],0.6999780535697937,0.0,0.48998463749885557
Mt me january wlt 22 complete unaa 22 maasa ganak gihin nisa mekt apply krtta wdk nti weid,Loans and Credit Services,2025-05-16T06:20:16Z,Commercial Bank,['commercial bank'],0.42365503311157227,0.0,0.29655852317810055
අවුරුදු 22 ට වඩා අඩු වෙන්න ඕනද සර්,Others,2025-05-16T02:07:23Z,Commercial Bank,['commercial bank'],0.5853318572044373,0.0,0.40973230004310607
"සර්  මට AL  -ABB 
කොමස් කලේ .

Ol  english වලට s එකක්  තියෙන්නේ .
icbt cmpus  එකෙන් english & it ඩිප්ලෝමා එකක්  කරල තියෙන්නේ .

ඒ ඩිප්ලෝමා එක  කරල තියෙන නිසා ol  engilsh -s එක  අවුලක් නැති  වෙයිද?",Digital Banking Experience,2025-05-15T21:19:57Z,Commercial Bank,['commercial bank'],0.8386457562446594,0.0,0.5870520293712616
මන් මේ වගෙ ජොබ් වලට ඇප්ලයි කල ඔන්ලයින් එත් කිසිම respond එකක් නැ. සුදුසුකම් ප්‍රශ්නෙකුත් නෙමෙයි. මට දැනගන්න පුලුවන් ද ඇයි ඉන්ටවීව්වත් කෝල් කරන්නෙ නැත්තෙ කියල කොච්චර කල් යනවද ඔන්ලයින් ඇප්ලිකෙශන් දාල උත්තරයක් එන්න,Customer Support,2025-05-15T15:38:53Z,Commercial Bank,['commercial bank'],0.3316957950592041,1.0,0.5321870565414428
"මට A/l s 1 yi thiyenne, O/L හොඳටම pass mata hoda salary ekak ගෙවන  job tikak kiyanavada  hoyala බලන්න",Others,2025-05-15T14:34:55Z,Commercial Bank,['commercial bank'],0.10879720002412796,0.0,0.07615804001688957
"Boc da , commercial yn eka hoda ??",Others,2025-05-15T13:40:48Z,Commercial Bank,['commercial bank'],0.4056861996650696,0.0,0.2839803397655487
Lanka orix finance payment karanna puluwan da,Transactions and Payments,2025-04-27T12:21:01Z,Commercial Bank,['commercial bank'],0.11207184940576553,1.0,0.37845029458403584
මම දැන් බැංකුවට ගිහින් මේ ගැන අහලා ආවා විතරයි. ඊට පස්සේ මේ වීඩියෝ එක දැක්කේ... ඇත්තටම වටින වීඩියෝ එකක්... ගොඩාක් ස්තූතියි දැනුවත් කිරීම සම්බන්දව.,Others,2025-05-16T06:03:03Z,Commercial Bank,['commercial bank'],0.3870021104812622,0.0,0.2709014773368835
ඔයිට වැඩිය මාර ලාබයි celinco එකේ investment plan එකක් දානවා.. පොලිය හම්බෙන්නෙත් වැල් පොලියට tax කැපෙන්නෙත් නෑ කීයක්වත්,Transactions and Payments,2025-05-20T13:52:55Z,Commercial Bank,['commercial bank'],0.5276231169700623,0.0,0.36933618187904355
"2023 රට එන්න කලින් මිලියන් දැම්මා මහජන එකේ, 21% දුන්නා අව්රුදු 2ට.",Loans and Credit Services,2025-05-18T22:02:54Z,Commercial Bank,['commercial bank'],0.4560003876686096,0.0,0.3192002713680267
"සල්ලි තියන අයට හොදයි ,අපි මාසේ ජිවත් වෙන්නෙත් දෙවෙල කාලා",Transactions and Payments,2025-05-18T17:29:55Z,Commercial Bank,['commercial bank'],0.473844051361084,0.0,0.3316908359527588
"කරුනාකර මාතෘකාව හරියට දාන්න, ""රුපියල් 18,000 තියනවනම් මිලියනයක් හොයන්න පුලුවන්"", ඇයි ලිව්වේ නැත්තේ ""මාස් පතා ආයොජනය කලයුතුයි"" කියලා?",Transactions and Payments,2025-05-18T12:18:45Z,Commercial Bank,['commercial bank'],0.6003528833389282,0.0,0.42024701833724976
"Useless වැඩ.
සල්ලි තියෙනවා නම් වෙන හොඳ ආයෝජනයකට යොමු කරන්න. එක මාසයක් හරි ගෙවන්න බැරි වුනොත් වෙන දේත් කියන්න ",Others,2025-05-18T12:10:43Z,Commercial Bank,['commercial bank'],0.07942748814821243,0.0,0.0555992417037487
අනික මේ බැංකුව පැත්තවත් යන්න එපා.  කපටි හොරු. රජයේ බැංකුවකට යන්න.,Trust and Security,2025-05-18T02:10:51Z,Commercial Bank,['commercial bank'],0.6106825470924377,0.0,0.4274777829647064
"එක එකාගාව සීට්ටු දාන අයට,තමන්ගේ අතේ මුදලක් ඉතිරි කර ගන්න බැරි අයට,අවමඟුලට සම්බන්ධ සමිතියකට බැඳෙන්න බැරි අය,දඹදිව වන්දනාවෙ වගේ ගමනක් යන්න ඉන්න එකපාර මුදලක් වියදම් කරන්න ලෝබ හෝ බැරි අයට මේ ක්‍රමය ගොඩාක් හොඳයි.එහෙම මං දන්න අය ගොඩාක් ප්‍රයෝජන ලබනවා.හොඳ විඩියෝ එකක්,",Trust and Security,2025-05-17T06:01:14Z,Commercial Bank,['commercial bank'],0.48185279965400696,0.0,0.3372969597578048
මේවට අහුවෙන්න එපා පව් මීට වඩා හොද ආයෝජන ක්‍රම තියනව,Others,2025-05-17T01:39:25Z,Commercial Bank,['commercial bank'],0.21978875994682312,0.0,0.15385213196277617
දැන් මිනිස්සු දීර්ඝකාලීන තැන්පතු දාන්නෙ නෑ.අලුත් බදු 10%ක් මුලු පොලියටම ගහපුවම ඔය කියන ගාන එන්නෙ නෑ.දීර්ඝකාලීන තැන්පතු ලොකු මුදලක් දැම්මොත් බදුසීමාව වන ලක්ශ 18 පැන්නොත් ලොකු මුදලක් ටැක්ස් එකට කැපෙනවා.මිනිස්සු එන්න එන්නම බැංකු වලින් ඈත් වෙනවා.,Others,2025-05-16T17:57:12Z,Commercial Bank,['commercial bank'],0.053719617426395416,0.0,0.03760373219847679
විදෙස් රටක රැකියාවක් කරන කෙනෙක් මෙය ආරම්භ කරන්නේ කොහොමද,Others,2025-05-16T10:31:33Z,Commercial Bank,['commercial bank'],0.3909972012042999,0.0,0.2736980408430099
"මීට වඩා ලාභයිනෙ බං 
භාණ්ඩාගාර බිල්පත් දාන එක. 

භාණ්ඩාගාර බිල්පත් ඉතාම පහසුවෙන් මහජන බැංකුවෙන් දාන්න පුළුවං.(පුළුවං තරම් main ciry වල බැංකු ශාකා නැතිව වෙන ඒවගෙන් බලන්න, අත්දැකීමෙන් කිව්වෙ)

(ඔය මොනතරම් gains ආවත් 10% with holding tax papers වලට sign කරන්න ඕනි ඔයාගෙ ආදායම 150,000 ට අඩුනම් මාසික වශයෙන්)

ඒ වගේම විශේෂම දේ තමා.. භාණ්ඩාගාර බිල්පත් වල ආයෝජනයෙදී ඔයාල කිසිම Tax එකකට යටත් වෙන්නෙ නෑ වගේම, ඔයාලට ඕනි වෙලාවක දමන ඇයෝජන මුදල් කර ගන්න පුළුවං. 

ඒ වගේම පවරන්නත් පුළුවං.

ඒ වගේම අවම මුදල රු. 10000/- සිට ආයෝජනය කරන්නත් පුළුවං.

එකම දේ පොඩ්ඩක් documents fill කරන්න ඕනි.

එයාල දෙනව එයාලගෙ head office treasury hotline number එක.. එයාළ එක්ක උදව් ගන්නත් පුළුවං..

මම නම් රු. 10000 ඉදං දාන්නෙ treasury Bills විතරයි..

fds දානවට වඩා ලාභ වගේම..

පුරුදු උනාම ආයෙ fds ඕනිම නෑ..

පොඩි ගානක් දාල try කරල බලන්නකො... ආස හිතෙයි ",Transactions and Payments,2025-05-16T07:42:28Z,Commercial Bank,['commercial bank'],0.26626887917518616,1.0,0.4863882154226303
ලස්සයකට මාසට පොලී කීයක් ගන්න පුලුවන්ද සර්,Transactions and Payments,2025-05-13T06:04:59Z,Commercial Bank,['commercial bank'],0.7430597543716431,0.0,0.5201418280601501
සම්පත් බැංකුවේ ලක්ෂ 1000000 ට පොලීය කීයද?.,Transactions and Payments,2025-03-08T14:10:52Z,Commercial Bank,['commercial bank'],0.6327943205833435,0.0,0.4429560244083404
"ලක්ෂ 5,mahset,පොලිය කියන්න f.d",Transactions and Payments,2025-03-04T00:04:39Z,Commercial Bank,['commercial bank'],0.7061845660209656,0.0,0.49432919621467586
බැංකු දෙකේම මේ ගනන් වලට මාසෙකට කියක් ලැබෙයිද,Transactions and Payments,2025-03-01T16:48:27Z,Commercial Bank,['commercial bank'],0.5293057560920715,0.0,0.37051402926445004
100000/= මාසිකව  පොලිය කීයක් වෙයිද,Transactions and Payments,2025-03-01T14:55:21Z,Commercial Bank,['commercial bank'],0.7460150122642517,0.0,0.5222105085849762
ලක්ෂ යක්  දැම්මෙත් මාසිකව  පොලිය කියද,Transactions and Payments,2025-03-01T12:56:44Z,Commercial Bank,['commercial bank'],0.7558727860450745,0.0,0.5291109502315521
ලක්ෂයක් දැම්මොත් මාසෙට කීයද,Transactions and Payments,2025-03-01T09:57:07Z,Commercial Bank,['commercial bank'],0.7375743389129639,0.0,0.5163020372390746
ලක්ෂ 50 ට මාසෙට පොලිය කියද,Transactions and Payments,2025-03-01T05:26:04Z,Commercial Bank,['commercial bank'],0.7430641651153564,0.0,0.5201449155807495
ලක්ෂ 10 ට මාසිකව පොලිය කියක්ඩ්ඩ,Transactions and Payments,2025-02-28T11:13:25Z,Commercial Bank,['commercial bank'],0.7398205399513245,0.0,0.5178743779659271
ලක්ෂ 40ක 50ක මුදලක් තැන්පත් කරන්න  හොදම විදිහි සදහන් කරන්න මම විදෙස් ගත ඉන්නේ,Transactions and Payments,2025-02-28T08:56:50Z,Commercial Bank,['commercial bank'],0.6083796620368958,0.0,0.425865763425827
ලක්ශ පහකට මාසිකව කීයක් ලැබෙයිද,Transactions and Payments,2025-02-28T02:20:44Z,Commercial Bank,['commercial bank'],0.770428478717804,0.0,0.5392999351024628
කැල්කුලේට් කරන හැටි කියා දෙන්නකො,Others,2025-02-27T17:36:50Z,Commercial Bank,['commercial bank'],0.6512253284454346,0.0,0.4558577299118042
ලක්ෂ 7ක් කමාසල් බැංකුවෙ දැමිමාම මාසෙකට පොලිය කීයද.,Transactions and Payments,2025-02-27T14:37:24Z,Commercial Bank,['commercial bank'],0.6327857375144958,0.0,0.4429500162601471
රැ ලක්ස පහක් සමිපත් බැංකුවෙි තැන්පත් කලොත් මාසෙකට පොලිය මුදල කියක් ලැබෙනවද?,Transactions and Payments,2025-02-27T08:51:06Z,Commercial Bank,['commercial bank'],0.7828087210655212,0.0,0.5479661047458648
මට විස්තර  දැන ගන්න කෝහොමද,Others,2025-02-27T06:31:51Z,Commercial Bank,['commercial bank'],0.5103839635848999,0.0,0.3572687745094299
මට ලංකාවෙ කොමෙන්ෂල් එකේ කවුන්ට් එකක් තියෙනවා තියෙනවා. මං ඒකට කොහොමද එහෙම කරන්නේ දැන් මම රට්නේ,Digital Banking Experience,2025-02-27T05:36:24Z,Commercial Bank,['commercial bank'],0.48233726620674133,0.0,0.3376360863447189
NDB  Wealth   එකේ  money  market  account  එකේ  පොලිය  8.1% යි.,Transactions and Payments,2025-02-27T05:10:41Z,Commercial Bank,['commercial bank'],0.7268547415733337,1.0,0.8087983191013335
සම්පත් බැංකුවේ ලක්ෂ පහක් දැම්මොත් මාසෙකට පොලිය කීයක් ගන්න පුළුවන්ද,Transactions and Payments,2025-02-26T16:55:44Z,Commercial Bank,['commercial bank'],0.6443724632263184,0.0,0.4510607242584228
ලක්ෂයක් දෙම්මොත් මාසෙට පොලිය කියද පිළිතුරක් දෙන්න මල්ලි ,Transactions and Payments,2025-02-26T14:38:52Z,Commercial Bank,['commercial bank'],0.7013674974441528,0.0,0.49095724821090697
එතකොට ලක්ස පහක් අවුරුදු පහකට දැම්මොත්.. මාසික පොලිය 500000%8.5 = 85000  නෙද....,Transactions and Payments,2025-05-19T10:21:04Z,Commercial Bank,['commercial bank'],0.7636529803276062,0.0,0.5345570862293243
ඒ ෆොන් නම්බරෙ නැත්තම් මොකක්ද කරන්න ඔනි,Digital Banking Experience,2025-05-09T15:46:40Z,Commercial Bank,['commercial bank'],0.8039439916610718,0.0,0.5627607941627502
අපේ උබලගෙ බැංකුව ගැන අපේ  විශ්වාසය නැති වුනා,Others,2025-03-08T15:10:10Z,Commercial Bank,['commercial bank'],0.541738748550415,0.0,0.3792171239852905
"Commercial bank eka gana tikak hoyala balanna ona, mageth salli wagayak kapala poliya adu karala thibba Money market account eke.Account eka open karala awata passe SMS walata kiyala 500k kapala, mase poliya dala naha.",Trust and Security,2025-05-15T11:34:34Z,Commercial Bank,['commercial bank'],0.5551255941390991,0.0,0.38858791589736935
හපොයි..හපොයි..ලොකුම කස්ටමර් බේස් එකක් තියෙන පුයිව්ට් බැංකුව කියගා තමයි කියන්නේ..එකවුන්ට් එකක් දාන්න හිටියේ..ඕනෙම නැහැ එහෙනම්,Trust and Security,2025-04-26T12:14:27Z,Commercial Bank,['commercial bank'],0.6961377263069153,0.0,0.4872964084148407
Mg com bank account eken 16000 kepila tibba.. Hebei mata eka aye hadala dunna benk eken.. Eunata bayai tama,Digital Banking Experience,2025-04-22T17:13:19Z,Commercial Bank,['commercial bank'],0.5000767707824707,0.0,0.35005373954772945
okay bank niladarin danuwathwa siduwe.hoda welawata mama account eaka oya bank eake open kale  naththe.,Digital Banking Experience,2025-04-18T16:21:32Z,Commercial Bank,['commercial bank'],0.5793614387512207,0.0,0.40555300712585446
",කාර්ඩ්  එකෙන් ගනු දෙනු  කරන  කොට  බිල ගෙවු විට එම බිල දෙතුන් වතාවක්  කපනවා  ඒ  ගැන සැලකිලිමත් වෙන්න   කාඩ්  එකෙන් බිල් ගෙවද්දි  එම බිල් රිසිට්  ලබා ගන්න  ෆොන්  එක බලන්න  බිල දෙවතාවක්  තුන් වතාවක්   වැදිලද  කියලා ඊළගට  ඕකුන්  කියන්නෙ මෙහෙ කැපිලා නෑ බැන්කුවට යන්න කියලා බැන්කුවෙන්  බඩු ගත්තෙ නැ  හොද හිතින්  ගෙවපන් මගෙ සල්ලි    ...හ්..හ්..කා  ගන්නෙ  ..නැතුව කියලා එතන පෙරලි  කරලා නැත්නම්  හ්..හ්.....ක්.කවෙනවා",Trust and Security,2025-04-17T06:08:16Z,Commercial Bank,['commercial bank'],0.8259434700012207,0.0,0.5781604290008544
Mage salli 2parak 3100 3100.....6200 kapala aiye Mata a salli denne nehe kiyanava....kohomada aiye a salli ganne kramayak kiyala dennako,Others,2025-04-16T10:38:51Z,Commercial Bank,['commercial bank'],0.05285552516579628,0.0,0.03699886761605739
අනිවාර්යෙන් මුන්ගේ ATM  වරදින් ..වෙනත් බැංකු card හිරවුනාම..හිරවුන සල්ලි ගන්න මාස ගනන් යනවා..ජරාම සර්විස් එකක් තියෙන්නේ,Trust and Security,2025-04-16T02:55:15Z,Commercial Bank,['commercial bank'],0.8230360150337219,0.0,0.5761252105236053
කොල්ලුපිටියේ BOC මගෙ ලක් ෂ 1 1/2 ක් හොරා කෑවා. යාළුවෙකුගේ  online payment  35000 හොරා කෑවා,Trust and Security,2025-04-15T09:09:34Z,Commercial Bank,['commercial bank'],0.7949966788291931,0.0,0.5564976751804351
ma banku kohamath wadakk na unga wasiyata vithari wada karanna gawanakmm vithari hoda unta,Trust and Security,2025-04-15T05:53:57Z,Commercial Bank,['commercial bank'],0.6525394916534424,0.0,0.4567776441574096
මං ඉන්නේ රට  කොමෂල් එකේ තමා පොත තියෙන්නේ මං දෙපරක් සල්ලි දැම්මා එත් එයාලා ලකුණු කරන්නේ නෑ පොත පස්සේ ලකුණු කරලා දෙන්නම් කියනවාලු බැංකුවට ගියාම මට මෙහෙ ඉදං වෙන බැංකුවක පොතක් හදන්නත් බෑ සල්ලී දාන්න දැන් මොකක් කරන්නද හිතා ගන්න බෑ,Trust and Security,2025-04-14T13:35:39Z,Commercial Bank,['commercial bank'],0.4700990915298462,0.0,0.3290693640708923
සක්කිලිම බැංහුවක් මචංලා සර්විස් එකත් අන්තිමයි. යන්න ෆෑන් එශියා එකට මාරම කස්ටමර් සර්විස් එකක් දෙන්නේ....පට්ටම හොඳයි.,Trust and Security,2025-04-14T07:42:37Z,Commercial Bank,['commercial bank'],0.48699355125427246,0.0,0.3408954858779907
කොමර්ශල් බැංකු හොරු. කාඩ් වලින් තමයි හොදට ගේම ගහන්නෙ. මේක මගෙ යාලුවෙක් කියපු කතාවක්.,Trust and Security,2025-04-14T07:01:50Z,Commercial Bank,['commercial bank'],0.78031325340271,0.0,0.5462192773818969
",ලංකාවෙ තියෙන ජරාම  බැංකුව",Others,2025-04-14T03:23:55Z,Commercial Bank,['commercial bank'],0.48331329226493835,0.0,0.33831930458545684
මම නම් සල්ලි  ආවද ගත්තා,Others,2025-04-13T18:13:02Z,Commercial Bank,['commercial bank'],0.16604553163051605,0.0,0.11623187214136123
දැනුවත් කලාට Thank you,Others,2025-04-13T16:38:27Z,Commercial Bank,['commercial bank'],0.7240363359451294,0.0,0.5068254351615905
මම අවුරුදු ගානක් ගනුදෙනු කරනවා හැබැයි මට නම් ඔහොම ප්‍රශ්නයක් වෙලා නෑ.  ඒ අතින් කොමශල් තලවතුගොඩ ශාකාව හොදයි,Trust and Security,2025-04-13T15:16:10Z,Commercial Bank,['commercial bank'],0.7142044305801392,0.0,0.4999431014060974
හපොයි මෙහෙමත් බැංකු හොරු...කොහොමද  බැංකු විශ්වාස කරන්නේ,Trust and Security,2025-04-13T13:38:15Z,Commercial Bank,['commercial bank'],0.662238597869873,0.0,0.4635670185089111
මගෙත් දෙපාරක් ඔහොම උනා.. 2025 පෙබරවාරි හා මාර්තු මාස වල.. Letter එකක් දෙන්න කිව්වා.. තාම මොකුත් reply එකක් නෑ..,Customer Support,2025-04-13T12:22:23Z,Commercial Bank,['commercial bank'],0.78245609998703,0.0,0.547719269990921
"අනේ මේ කියන කතාව 100% ඇත්ත වෙන්න ඕනා.මොකද 2025/4 /2 මගේ a/ c එකේ තිබුන සල්ලි 120000/= ක් 2දා එකම දවසේ හතර පාරක් කපාගෙන. කමර්ෂල් බෑන්ක්, කුලියාපිටිය branch එකේ. මම දැනගත්තේ 6 වෙනිදා. bank  එකෙන් ඇහ්වම එයාලා කියනවා  google එකේ කාඩ් no save වෙලා තිබුනොත් තමයි එහෙම කැපෙන්නේකියලා.කැපිලා තියෙන්නේත් apple . Come කියලා එකකින්. ඊට පස්සේ කාඩ් එක block කරා.දැං මට හරි බයයි bank වල ගනුදෙනු කරන්න.කාඩ් පාවිච්චි කරන අය හරි පරිස්සමට.",Trust and Security,2025-04-13T01:31:54Z,Commercial Bank,['commercial bank'],0.7464156150817871,0.0,0.5224909305572509
කෑ ගහන්න එපා කිවුවේ මොකාද මට කිව්වනම් කවුන්ටරයෙන් අත දාලා දෙනවා කණ රත් වෙන්න බේසිගේ පුතාට,Trust and Security,2025-04-12T19:00:44Z,Commercial Bank,['commercial bank'],0.6711984872817993,0.0,0.4698389410972595
අනේ මමත් රට ඉදන් සල්ලි යවන්නේ මේකට මම හැබැඉ සල්ලි තියන්නේ නෑ,Others,2025-04-12T17:37:42Z,Commercial Bank,['commercial bank'],0.05247975140810013,0.0,0.03673582598567009
Me kthwa attha me bank eken salli kapa gnnw card eken mageth ehema una 6000k eyla ahuwama kiynne online payment kthaw tamai,Transactions and Payments,2025-04-12T16:39:39Z,Commercial Bank,['commercial bank'],0.43741583824157715,1.0,0.606191086769104
"Commercial  එකේ සල්ලි දානවනම්...
පිනට දුන්න කියලා හිත හදාගන්න තත්වෙට හිත හදාගන්න පුලුවන්නම් දාපන්",Transactions and Payments,2025-04-12T16:35:51Z,Commercial Bank,['commercial bank'],0.5687144994735718,0.0,0.3981001496315002
ඔය බැංකුවේ සල්ලි දාන්න එපා.ඔය ජාවරම් කාරයො අල්ලලා දෙන්න .,Trust and Security,2025-04-12T09:30:43Z,Commercial Bank,['commercial bank'],0.7802239060401917,0.0,0.5461567342281342
Aeththa kathawa.nittambuwe nihal super branch  eakath ehemai.commercial  bank eaka wishwasha karanna amarui.,Trust and Security,2025-04-11T13:59:39Z,Commercial Bank,['commercial bank'],0.8007038235664368,0.0,0.5604926764965057
අපෙත් සල්ලි තියනව අයින් කරන්න ඕන,Others,2025-04-11T09:38:50Z,Commercial Bank,['commercial bank'],0.22698523104190826,0.0,0.15888966172933577
