Comment,Aspect,Date
o/l english walata  first shy ekee  c pass ekak thiyenneh habi deweni sare b pass ekak thiyanawa. mata commercia bank ekata apply karanna puluwanda,,2025-05-21T17:46:15Z
sir 1 shyma o/l English A OR B balanawada mata o/l English 2 shy English B thiyenawa .mata apply karanna puluwanda,,2025-05-20T15:49:01Z
Ane 23 i mata. Dammath wadak nathi weida,,2025-05-19T16:39:41Z
"O/L    maths-A   ,english-C apply krnn puluwanda",,2025-05-19T06:22:06Z
"sir, campus yanakan internship yanna me link ekenma gihin internship kiyala thiyena thena apply karanna puluwan naada sir?
commercial bank eke internship walata pay karanawada sir?",,2025-05-17T18:34:33Z
sri meka 2 years da. job eka sthira kara ganna chance ekak nadda meke,,2025-05-17T18:23:58Z
Meka boc trainee wge ekkd ?,,2025-05-17T16:53:49Z
english  c thibba nam apply karanna berida,,2025-05-17T14:38:59Z
Campus enakn yanna mewata apply karanna puluwanda?,,2025-05-17T10:38:00Z
Management degree ekakta hondma private university eka mkda ,,2025-05-16T14:38:47Z
"Sir, Accounting special degree ekak thiyna graduateslata thiyena job vacancies kohomda",,2025-05-16T14:36:50Z
Sir meke training period eka kochchra kalaykd? ita kalin ain wenkot api apahu gewanna oned,,2025-05-16T08:28:50Z
"Sir 24 a/l university yanna inna ayata  apply karanna puluwan firms,jobs monawada?",,2025-05-16T06:58:51Z
Mt a/l english s ekk thinne . ek aul giypu nisa mn Mn spoken english course ekk kra.   Dn Diploma in banking and financial eke fist ek complete kra .. thma result awe na  second ek me year eke krnwa mt apply krnn puluwn d mekat,,2025-05-16T06:34:18Z
Exame ekak nadda..BoCwala wage,,2025-05-16T06:08:29Z
Sir mama bba degree karana gaman inne.mata mekata apply karanna barida 24 i. Age wadi aya ethakota ganne mona wage positions da,,2025-05-16T03:37:21Z
"Tawakalika job nadda bankswala
University patan gannakam karanna puluwan",,2025-05-15T13:54:13Z
Ol wala maths s ekayi english s thiyenne A/ L nam ABC risalt thiyanawa maya applay karanna bahada ,,2025-05-15T13:26:17Z
"Maths S pass English A pass for O/l
Apply karanna puluwanda ?",,2025-05-15T13:04:13Z
Aiyee mge ek hadann banee,,2025-05-06T07:40:50Z
Mobile app eken puluwanda meka karanna,,2025-03-14T07:04:23Z
ටර්න්ෆර් පේමන්ට් කියලා එකක් පෙන්නනේ නෑනේ,,2024-05-29T16:07:04Z
කස්ටම් එකට කතා කරන්න කියන්නේ .මගෙ baranh eke d,,2024-05-20T04:12:08Z
Nrfc gana ekak Danna,,2025-05-23T01:51:47Z
Period eka wadi wena tharamata apita bankuwen hambena gana wadi lamayek hadana ayata mewa godak hodai lamaya hadanna innawann me wage ayojana krama wala MUDAL dann lamayata aurudu 18 weddi thamange deyak  ho usasadyapanayata bawithakaranna puluwan katawath nawenne nathuwa,,2025-05-18T15:22:39Z
Business ekata dala meka one day hoyanawa.meka moda wedak,,2025-05-17T16:29:48Z
Mekata danna epa man danatamath dala theyenne  thawama Mata Pollya hadela theyenne rs dayak wade gank wetharai . Dan dala masa hayak wethara wenawa dala .hareyatama deneta watune nath nam no interest. Dana Kota keewe nha. Math Meka cansal karanawa. Mane ac ekak ita wada hodai,,2025-05-17T12:36:02Z
Mewa boru weda 49000k ganna awurudu dekak balance inna pissuda.laksha 5k yata karala.modayanta Hoda mewa,,2025-05-16T19:14:44Z
ස්තුතියි,,2025-05-16T18:00:13Z
Bro money market eka gana video ekak ona,,2025-05-19T08:29:07Z
Meka hamanenne gihin bank ekenma ahapallaako,,2025-03-09T07:36:37Z
Danna poliya,,2025-03-08T11:09:41Z
1000000  f.d  maa sekata ke yak. Ganna. Pulu wan da. ?,,2025-03-01T09:31:59Z
100000k demmoth maseta kiyak wage lebenawada,,2025-03-01T06:38:24Z
කෝ මේ දාලා තියෙන ඒවට රිප්ලයි,,2025-03-01T06:21:02Z
"40,00000/= keeyak lebenawada",,2025-03-01T04:35:27Z
calculator karala danna malli,,2025-03-01T01:21:48Z
Ane  mama deamaauruadaka  koamsal  aeke  mata. Leamuane. Nh poalisiaya ,,2025-02-28T07:56:48Z
Lk 10 k දැම්මොත් poliya masika kiyada.,,2025-02-27T14:47:35Z
Masa 3n poliya ganna puluwanda,,2025-05-07T06:09:36Z
Poliya hodatama adui naeda mokada salli gedara thiyan innawa hodai.,,2024-11-28T11:45:50Z
පට්ට්ම  හොරු,,2024-11-25T05:12:03Z
laksha 20 dala dina 100 kalpirimedi kiyak lebenawada,,2024-10-01T17:24:30Z
Sampath mony market account ekatath 7% denawa salli gannath puluwan dannath puluwan ,,2024-07-23T18:36:18Z
අනේ සිරිසේන,,2024-07-16T11:32:00Z
Hemadama oya Pacha kata keyana EPA halo avurudak antemata poliya gannakam ape  etek kanne ohelage etad..da,,2024-07-16T08:52:27Z
"අටපට්ටම ට කියන්න,",,2024-07-16T04:03:59Z
මේ බොරු වලට අහුවෙන්න් එපා,,2024-07-15T10:13:28Z
ඔය මොන පොලියක්ද?,,2024-07-12T03:16:40Z
"Oka ithin wenas deyak neweine masa 3ta denneth 7%i.... Dina 100ta muladi geuwa 14%k....eyalata mudall lebenawa wedi kiyala eka 11ta adu kara, den 7i",,2024-07-11T12:57:01Z
ප්ප්ප්ප්ප්ප්ප්ප්,,2024-07-10T22:11:33Z
Malli man kuwet inne mata coddeka awe nane mehe nisa wenna ati neda,,2024-11-21T11:16:58Z
Phone number eka dn nettan mokuth Karanna barida,,2024-10-31T10:44:05Z
Meka hadagatthama 5 gaane kepenawani,,2024-09-19T11:45:33Z
Bro mata kiyanna puluwanda rata inna kenek kohomada online transer eka hada ganne kiyala,,2024-05-25T08:36:13Z
Mage athin e sim eka nathi una ehama unoth hadaganna barida,,2023-09-30T08:49:58Z
Tanx අයියෙ දන්නැති දෙයක් කියලා දෙනවට ඵල ,,2023-07-28T18:32:28Z
Anee e dila tiyena namber Eka Laga nanee,,2023-07-02T03:26:59Z
Account eka hadaddi thibun number eka  nathinam,,2023-04-03T15:44:32Z
mama haduwe dotcom card ekak ethakota mama id ekata mokadda gahanne,,2023-02-03T12:27:18Z
වෙන කෙනෙක් salli dammahama අපිට messege ekak ena widiyat hadaganne kohomad,,2022-08-11T08:28:12Z
Mata app eka hadaganna baruwa hitiye.kiyala dunnata bohoma isthuthii.godak pin,,2022-06-27T05:37:42Z
Thnks aiye godak watina video ekak,,2022-04-05T03:25:13Z
Mata denaganna one me app eken mage phone eken Ara wena phone ekakin log wela ganudenu karanna puluwan da,,2022-04-03T12:43:13Z
Mage parana ekaut akakuth thiyanwa,,2022-03-26T23:43:08Z
Mekata salli kapenawada,,2022-02-11T03:33:56Z
Meken apita salli tanser karanna barida,,2021-12-29T08:31:51Z
Machn uba ගනුදෙනු kiyana wachane theruma danawada,,2021-12-22T12:43:21Z
Mage app eka notification pennana na ne,,2021-11-18T04:21:35Z
Mekata maasikava gaadthuwak aya karanawadha??,,2021-11-16T09:41:08Z
App eka da gaththama kiyak kapenwada,,2021-10-25T12:36:52Z
Meken musal transfer krnne komda,,2021-09-26T09:28:11Z
Overseas inna kenekta kohomada meka accept karaganne.. lanakwe no ekakmada danna ona code eka gennaganna. Wena widiyak nedda kiyanna puluwan da? Thx,,2021-09-19T19:12:53Z
Cod ekak denne na ne,,2021-09-17T17:26:59Z
Ginuma hada ganna deepu number eka natnam mokada karanne?,,2021-09-17T06:37:38Z
Card eka nathan app eka pawichchi kranna pluwanda,,2021-09-15T17:43:10Z
Thank you aiya,,2021-09-08T18:37:58Z
Account name eka apita balaganna krmyk ndda,,2021-09-01T12:12:14Z
Aiyye parana number ekata adala tiyenne aluthen adanavanam khomada adaganne e SIM eka api kadava Dan aluth number ekata adaganne khomada,,2021-08-28T07:49:41Z
thanks aiya.,,2021-07-21T16:55:15Z
4n num eka unvalied kihka wetenwane,,2021-07-16T13:38:50Z
4n namber  eka amathakainam barida,,2021-06-10T07:25:50Z
Mahajana bankuwe app aka ganath video akak karannako...,,2021-06-07T15:18:32Z
Aiye meke ginum sheshaya ganipu ewa delet krnn brid,,2021-06-01T08:23:12Z
Meka hadnkota account aken kiyak kapenvd,,2021-05-29T04:56:35Z
mchan meke ar number eka nattm mokad karanne,,2021-05-21T05:21:28Z
Mage banku pothe name eka akurak varadi eeka hadaaganna puluwanda. Mata vayasa 18 ta adui,,2021-04-12T03:31:05Z
Meken mudal ganudenu krnna puluwnda?,,2021-03-08T17:00:15Z
Api blnce ehma check krddi salli weya vimak wenwda,,2021-02-14T12:56:20Z
Access cord eka kohomada ganne,,2021-02-03T17:59:39Z
Teliphone no eka unvalid kiyalane enne mona no dunnth ehmai enne.,,2021-01-22T12:55:11Z
"Phone nu. Eka wenasnan kohomada karanne,acc. Eka open krddi dipu nu. Eka wenasnan,",,2020-12-28T14:02:45Z
කොයි තරම් කලයක් තියන්න ඔනේද,,2024-06-19T08:55:06Z
Ethakota apita apahu dapu salli okkoma withdraw karaganna puluvan kamak thiyenavada,,2024-02-07T12:44:16Z
Sampath  එකේ නැද්ද ඕක,,2023-09-04T07:59:18Z
YOU CUT DOWN THE CREATORS TREES TO MAKE YOUR FAKE MONEY THEN HAVE THE AUDACITY TO THINK THAT YOU RULE THE WORLD  DELUSIONAL IS WHAT YOU ARE ..ASE HEKA AMEN RA AHO MOORE NATION GRAND RISING KARMA REST IN PEACE 🪦,,2025-01-25T18:02:28Z
Niyamai aiya,,2023-01-16T10:28:25Z
Ane thnq man godak igena gaththath atm eken  salli ganna vidhiha mata vayasaka manussayek thamai kiyala dhunne . Adha mata me ken godak prayojana una thnq,,2023-11-28T06:32:42Z
""" හිතල තිබ්බෙ නෑ මල්ලී, ඌ මැරුනද? "" පොලීසියට පුලුවන්ද මේ විදිහට පාරෙ අය අහිංසකයොන්ට වෙඩිතියන්න - https://youtu.be/KFnO5DfBv_E",,2024-01-19T02:37:15Z
thanks bro mamge 65 danna hitiye ammo mun,,2025-05-19T10:28:48Z
සිරා කතාව මුන් මේ විදියට තමයි කරන්නේ,,2025-04-16T12:21:25Z
A salli lebunada aiye,,2025-04-16T10:34:39Z
අම්මෝ හොඳ වෙලාවට මේක දැක්කේ,,2025-04-16T06:19:34Z
2023 වුනත් නොදන්න අය මේක බලලා Update වෙලා ඉන්න එක හොඳයි..,,2025-04-15T03:20:09Z
සුපිරි bro,,2025-04-14T21:23:20Z
ඇත්ත මට දෙපාරක්ම උනා,,2025-04-14T14:05:13Z
Ammmooooo me mona Aparadayakda? Rupiyalak nathe wunath a de thange duk mahansi salline... pau deiyanedipiyaw yakoo bslu wada nokara,,2025-04-14T13:36:57Z
මෙහෙම දැනුවත් කිිරිම නම් ඉතාම වටිනවා.මම හිතුවේ මට විතරයි කියලා .දැං බලපුවාම ගොඩක් මේ වගේ වෙලා තියෙන්නේ මුං හොර ගේමක් ගහනවා වගේ.,,2025-04-13T01:34:30Z
Kiwwa eka hoday hora guhawak ehenam,,2025-04-11T18:44:49Z
Hapo paan esiya bankuwath e wage horu inna thanak ape mahaththayage panshan eka enne ethenta un horata longahala Laksha thunayi haththa pan daahak aragena apita thamayi eka gewanna kiyanne okunta hena Gahanna ona bohoma sulu ganayi athata ganna labenne API mekata mokada karanna ona kiyala kiyanna kawuru hari danna kenek ane pin sidda wenawa ..,,2025-04-11T16:50:27Z
මොන සිටිඑකෙද කියන්න පුලුවන්ද මහත්මය.,,2025-04-11T05:25:07Z
Ane wisadumak tiyeda api duk widala hoyapu salli,,2025-04-09T08:43:46Z
"Mageth salli kapuwa 20000k
Kagahala kagahala maat gatte",,2025-04-09T06:05:07Z
Homagama branch eka,,2025-04-08T03:11:04Z
Aya apata salli Damme na aiye,,2025-04-08T03:10:38Z
Meka nm aththama aththa..maget podi podi ganan kepenwa monata kepenwada kiyla nm mn danne na,,2025-04-07T17:15:39Z
Dan salli bak karala hodin account chaq karana,,2025-04-07T15:44:10Z
"Oya keyan katawa hare. 
Marathi ahem una.
Bank ake Sallie teyanna behe.
Kepenwa.
Oya paw.",,2025-04-07T13:27:55Z
matath meka una ......,,2025-04-07T05:51:24Z
FB danna  own tika,,2025-04-06T04:54:07Z
Aiye  nadu  danna,,2025-04-06T04:51:03Z
Malli oya apiwa danuwath krana eka hodayi prayiwat bank horuda parissamin oyata waradinne na jesupihitayi ,,2025-04-06T03:33:58Z
Kathawa aththa mageth salli kapila thibuna,,2025-04-03T17:27:59Z
Commercial aka Komath awul nayakayo ganna giyoth  thamath hena awul,,2025-04-03T06:34:19Z
ස්තුති මල්ලී,,2025-04-03T02:31:05Z
මේ  වට  යන්න  ඒපා,,2025-04-02T08:37:35Z
Ammoo malli den harima bayaine mee weda walata apith one dala thiyenne salli denma apahu  aran wena ahekata wath danna one,,2025-04-01T17:03:36Z
Ampitiya Sumanarathana himi channel eka balanna a himitath oya wage deyak wela  a wena bankuwakin,,2025-03-31T07:38:15Z
මටත්   ඒ දේ  උනා  මුන්  ඕන  කමින්  කපනවා  ඕක්‌ කෝ ම  එකතු  වෙලා  මේකෙන්  අයි න්  වෙන්න  ඕන ,,2025-03-31T00:51:03Z
මේ කතාව සීයට සීයක්ම ඇත්ත මොකද මටත් මෙහෙම වුණා,,2025-03-30T18:48:06Z
Mage account ekat me satiyema close karanawa,,2025-03-30T12:12:20Z
මටත් එහෙම දෙයක් වුනා,,2025-03-30T06:26:59Z
ඇත්ත මටත් පොතක් තිබිලා මම කැන්සල් කරා,,2025-03-29T19:59:21Z
අම්මෝ ,,2025-03-29T15:19:01Z
Mama FD ekak Dala hoda mattuwak una,,2025-03-29T13:50:39Z
Mama FD ekak Dala hoda mattuwak una,,2025-03-29T13:48:22Z
Matah Kela welada danne Neha  mallita pin 6:23,,2025-03-29T13:32:22Z
Meyalage atm card eka denneth athatamai kisima seftyk ne.hnb nm letter eke denne.matath den nm sekai.bayai.,,2025-03-28T05:53:53Z
දන්න එකෙක් යන්න එපා,,2025-03-28T05:39:13Z
මගෙත් එහෙම උනා.මුන් පට්ටම හොරු,,2025-03-28T05:38:14Z
Ape kenekutathe meka una,,2025-03-28T04:18:33Z
Ap000 ai mekata danna apa,,2025-03-28T04:18:11Z
මටත් මේ විදිහම වුනා,,2025-03-27T18:17:41Z
Puduma horuRata tama kiyapu eka hoday,,2025-03-27T17:04:32Z
Ape salli tikath ara ganna ona,,2025-03-27T17:03:41Z
Meka danuwath karata thanks,,2025-03-27T17:01:14Z
"එක තමයි ඔවා නියාමනය කරන්න ඔන ,,,,",,2025-03-27T11:05:49Z
Mun thani wanchawa maget atm aken salli demma nombar weraduna passe aka hadanna geya  mun mawa godak rasthiyadu kala wetharai kalama kanne,,2025-03-27T06:58:00Z
Mage ekath close karanna ona,,2025-03-26T09:20:47Z
බොහොම ස්තුතියි. ඔබට.,,2025-03-26T06:32:36Z
"ඔක්කොම kalakanni බැංකු ekai 
Hora ballo 
Okunta hena ගහන්න onne
Mahabanku kalakanni tika nidida",,2025-03-26T05:54:17Z
Link eka dannako,,2025-03-06T14:02:00Z
Meka viswasa karanna puluwanda ada kale hatiyata kohomada acaun namda denne,,2024-11-26T10:31:28Z
Thanks meka aththatama watina vidio ekak mage 4n ekata combank app eka ganna denne ne ithin mn hoy hoya unne komada thiyana gaana bala ganna kiyala,,2024-11-01T06:36:54Z
Meka register unm sallj kpnwd,,2024-10-12T11:13:57Z
Whatsapp ekata save karanne namber ekak nane,,2024-10-01T03:16:55Z
Godak watina video ekak.thank you akki.,,2024-06-01T14:38:20Z
ස්තුතියි ,,2024-03-04T21:58:18Z
Tnx hoda vidiyo ekak akke,,2023-11-27T01:27:23Z
link eka evannako,,2023-11-20T17:01:16Z
සුපිරි video ekak අක්කා ....,,2023-08-10T14:46:17Z
1xbet 1 app aeka sport nadda,,2023-06-20T16:29:52Z
Transer karanna barida,,2023-06-10T05:06:16Z
"Mreta wada hondai salli miriskudu dala kanawa...
Govt.fail....",,2025-02-19T15:37:23Z
බොහොම ස්තුතියි,,2025-02-17T02:35:27Z
Mn ben ekata dila thiyena mobile no eka dan weda karanne. Mn inne rata mata app ekata log wenna be. Pz hel me.,,2025-05-22T17:21:47Z
Mage app eka lock vela,,2025-03-20T15:03:49Z
User name ekai pw ekai amthakainam aye hdanna berida,,2024-11-22T13:12:19Z
Mata anthimata password aka dena thenata awa athanadi Error akak awa akata mokada karanne,,2024-08-09T16:23:32Z
Man korea inne awata passe bankuwata dila thiyena sim eka block unane..kohomada karanne ethakota mail ekak add karaganna barida,,2024-01-29T12:22:48Z
Aiyya mata password eka hadanna tharanne naha podak password ekak udha haraneta hadha pannako,,2023-06-19T14:17:14Z
Mekan apita onama kenakta salli yawanna puluwanda.,,2023-05-14T07:54:45Z
phone number wenuwata gmail eka denna bada,,2023-03-13T00:35:15Z
Mage pasward eka amathakai hadanna beida,,2023-03-07T13:53:58Z
aiye meken cad eke iyena balance eka balannath puluwanda,,2022-08-12T14:35:27Z
Anthima step eken yanna bane aiya,,2022-06-29T12:03:24Z
ACC no ekata enna oni mokakda,,2022-06-11T08:15:15Z
Ayye password aka ganne නෑනේ,,2022-06-04T03:49:31Z
Mage digital app 1ke log venna bene mata aka aktiv karala denna,,2022-05-02T11:01:08Z
register una sim eka nathinam meka karanna barida,,2022-04-30T09:00:25Z
Ayye mekata rejister vela meka use karath natath service charge ekk gannoda ,,2022-01-18T08:28:45Z
Commercial eken gewanna barida dn alibaba ekata,,2021-10-29T08:39:33Z
Commercial eke limit eka ain karala neda aiye dan thiyenne.?,,2021-10-27T21:18:21Z
Ada weddith me rates thiyenawa da,,2024-12-18T10:50:33Z
Laksa dekak stheera thanpath danna  barida?,,2024-11-30T00:04:10Z
ඔයාගෙ විස්තර කිරීම පැහැදිලියි .,,2024-10-29T02:55:56Z
Com digital app eken kohomada FD ekak danne?,,2024-10-21T09:29:37Z
Oka dannawa hutto,,2024-10-20T12:18:59Z
Dan danna puluvnda,,2025-04-30T06:25:10Z
Aiye meka permanentda.. man danata boc eke trainee wena kenek maasa 6kata thama gaththe.. man hithan inne ibsl course eka karala september exam karanna... commercial bank eken select wela training unata passe permanent da?,,2025-04-27T15:49:02Z
"Aiye Google form ek fill krnn witrd tiyenne
Naththn CV ekakuth upload krnn oned
Please kiyannko",,2025-04-20T04:29:13Z
"Thank you aiyee.
ඉස්සරහට තවත් මේ වගෙ එව දාන්න",,2025-03-30T07:01:42Z
ජර්මන් ටෙක් එකට full time කට්ටිය ගන්නවද,,2025-03-25T11:57:10Z
Ek rat phele ye dekh ke pass honeka ghamnd hai,,2024-03-13T16:42:28Z
