Comment,Aspect,Date
"This videos title is a bit clickbatey to my taste and is grounded in a very pedantic interpretation of most introductory econ textbooks. From econ class I always viewed the multiplier as a function of banks propensity to to give out loans and the reserve requirements merely as a, rarely binding, hard ceiling on what banks will be able to lend out. Whether you call it a bank reserve requiremets, capital requirements or dis/incentivicing loan creation by playing with the interest rate, the effect will be the same as that which you would get from varying reserve requirements. From a pedagogical standpoint I find it perfectly justified to explain the multiplier assuming banks are eager lenders bound only by reserve requirements and add a bunch of caveats about the different forms these lending limitations can take after a simplified understanding of money creation has been established. While I agree completely with everything contained in this video it gave me the false expectation that my understanding of economics was about to be shattered XD. I guess you cant make a living on youtube with nuance XD.
As an economics teacher I would actually stick to the way the multiplier is explained in most textbooks. Yes, its a simplification, but that is really all economics is.
Then in a second step you can add nuance to students understanding, explaining there is more than one way to get banks to hold higher reserves and that by increasing interest rates or capital requirements you can also elicit reactions in the ratio of loans to reserve holdings, in fact banks might constrain the multiplier entirely on their own because they are to afraid to give out loans in an otherwise auspicious monetary environment. I think only few actual economist ever took reserve requirements to be more than an, admittedly misleading, synonym of banks propensity to loan money",Loans and Credit Services,2023-08-21T16:50:34Z
"So banks are middle men between people and fed, where fed’s goal is increasing the size of the economy.
And this job of middle man is very lucrative due to lender privilege and scale.",Others,2023-08-05T22:01:02Z
"If people accept your checks at par to cash, you can technically create money.","Transaction, Payments and Accounts",2023-07-25T20:26:12Z
"Essentially, banks create money because they manipulate their ledger. When they give a loan, they change a few numbers on the bank account statements, and record on their spreadsheet that they owe bank account A $1M, and Bank Account A owes them $1M. When you want to spend your money, the bank debits a few digits off your end of the spreadsheet, and credits the account you pay. Since people accepts bank obligations at par to cash, the bank can create money by changing their spreadsheet to add points to someones account.",Loans and Credit Services,2023-07-25T20:24:21Z
"The amount they lend us, the bank gets 10x the credit……",Loans and Credit Services,2023-07-13T00:40:48Z
It’s against the law for banks to lend money…..,Others,2023-07-13T00:34:34Z
Banks steal our credit…….,Loans and Credit Services,2023-07-13T00:33:33Z
"Isn’t the hard limit the credit worthiness of the customers themselves and the competition for them. 

If I’m a bank and I’m worried you’ll default on your loan, then I’m not going to do the a loan because there’s a good chance I’ll have to write it off and eat the bad debt expense.",Loans and Credit Services,2023-07-03T21:43:05Z
commercial banks do not pay interest?,Others,2023-06-30T01:16:04Z
"you keep using that word, i don't think it means what you think it does.

the money multiplier is not a myth. 

it's just the laws were removed requiring banks to keep a fraction of deposits in order to let banks steal more from us.

in usa it was removed after the 2008 crash. in uk in the 80s i think.

the reserve requirements were real. 

and the money multiplier was the old way of putting lending limits on banks to prevent running out of cash and prevent bank runs.

also no bank will go to the central bank for more cash reserves as it is a sign of distress and will result in a massive bank run.

this is why they prefer to use the overnight money markets between themselves..

so fractional reserve laws when they existed did have the money multiplier effect on money supply. and why banks would offer interest to savers so much back in the days.

now with the laws removing fractional reserves and banks being allowed to lend without limits. savings account don't pay anything anymore as banks don't need to keep cash reserves to lend anymore.

so it isn't a myth.

Just old model. and maybe partially incomplete model. especially with the order of the transactions.",Others,2023-06-28T10:43:20Z
"I’m not going to lie this still makes it look like a Ponzi scheme. I know it is not because the central bank can just create money to back stop any issues but that fact alone makes it seem very scammy. 
It is worth noting that when people talk about the Money Multiplier Theory they start with how the initial money is created within the system. It typical goes like this. The Center Bank create money and lends it to the government which then spends it into existence. This of course create the economy.",Trust and Security,2023-06-28T10:32:14Z
"I don't understand how there can be a myth, and needing ""research"" to disprove something like this? 
Either the banks loan money they don't have, or they don't. 
So all this time economists and bankers have thought banks loan money they don't have, but in reality they've had the money all the time? 
How can thousands of banks exist, who's main mission and expertise are loans, money, and ledger, been surviving without even knowing how much money they have and how mush they have lended out? 
If I Gonnaga Bank have 1 million, and I loan out 2 million, I've done the Money Multiplier trick. But I haven't? I've actually earned my money by loaning 1 million and getting 1,2 back over the course of 20 years. 
HOW has this NOT been common knowledge if that's the case? HOW can you run a company that only needs to know plus and minus, and not knowing basic plus and minus? HOW can tens of thousands of companies whos only criteria is knowing plus and minus not knowing plus and minus, at the same time??",Others,2023-06-25T18:45:10Z
Svb failed cuz it couldnt fund customer deposit demand What did they do with that deposit money ? use to buy securities that lost value with interest rate rising?,Trust and Security,2023-06-24T00:49:21Z
So its just fractional reserve banking but the reserve requirement is 0%.,Loans and Credit Services,2023-06-23T16:52:24Z
"As per my understanding, reserve requirements are based on the capital or equity of a bank. If a bank is valued high, it needs to have more reserves. Deposits have no role in reserve requirements.",Others,2023-05-05T16:55:30Z
"I have been curious if the lack of lending post-2008 was driven by the supply or demand side of the lending market?  It seems the idea ""lower rates will spur lending"" is a purely demand-side phenomenon, but what about the compensation for risk on the supply side?  We could clearly see examples where banks undervalued expected inflation by offering extremely low rates even when a simple quantity of money theory predicts long periods of sustained inflation, which was what I called since I saw the spike in 2020.  Did markets get such a simple concept wrong or is there some other market force that can explain why banks kept interest rates so low despite the largest creation of money in history?  I can think of reasons why Moral Hazard might offer an explanation but I am curious to hear if anyone has any other bright ideas?",Others,2023-03-28T13:49:41Z
"While I comprehend the information, there is a question which comes to mind after watching twice to examine carefully. With regards to the “other side” of the banking operation as a depository for customer savings, why does the bank not have the required reserves on hand to offset a bank run in the first place?

If loans are solely “created by federal allowance” as you’ve demonstrated, that would suggest there would be an excess of reserves available for depositors, which we know for a fact is not the case.

It seems default is inevitable and the system is wired to bust no matter what occurs.",Loans and Credit Services,2023-03-23T14:54:40Z
"""Banks do not take your money and do lending and lending it out over and over again"" ?? That sounds like a strange sentence. The same bank does not do that, but multiple banks in a chain process do actually do that. So I don't see your refutation that money is being multiplied across banks. You then jump quickly to the amount of money creation but you haven't refuted the multiplication across multiple banks",Others,2023-03-22T09:59:23Z
Money is created with debts. You go at the bank for a mortgage etc… They will lend you money that doesn’t even exist but it will when you will be done paying it. That’s how they create money. Simple as that.,Loans and Credit Services,2023-03-22T02:39:20Z
they publicized the G20 Nations banking definitions for savings accounts so you have no excuse,Others,2023-01-23T13:19:46Z
Banks is not stealing  money you see because when you deposit or sign .(your)money by your   (signature)  you transfer title of that money over to the bank ....you become an unsecured creditor ??,"Transaction, Payments and Accounts",2023-01-23T13:13:59Z
"Aren't capital requirements just reserve requirements, but in reverse?

So instead of people depositing money in the bank and the bank then using it to loan out a multiplier of that money, the bank loans out as much as it can, but has to then keep a percentage of that (7-8%) as capital.",Loans and Credit Services,2022-12-30T15:41:40Z
"What is being obfuscated by our very language is: banks create credit, not currency. Credit is a claim on currency, not the currency itself. When a bank loans me $200k to buy a house, a real claim on real central bank currency must be transferred from me to the seller, either in the form of hard cash, or a claim on hard cash in a checking account. In exchange, I must retrieve $200k plus interest over the term of the loan by working for it, and giving the money I receive to the bank. In this way, banks don't really create money insofar as they create currency, banks create money insofar as they create future claims on currency: the central bank is still the one who creates the actual currency.",Loans and Credit Services,2022-12-12T09:47:45Z
That is not how fractional reserve works! Banks lend money over long periods even after the interest is collected the value of the interest would be diminished by inflation and devaluation depending on the currency and the time. All banks would go bankrupt by this logic.,Loans and Credit Services,2022-12-05T15:01:06Z
"I have a question, what stops people of starting their own bank and doing dumb loans to their friends if the money doesn't exist at the beginning? Or simply starting your own bank to finance yourself?",Loans and Credit Services,2022-11-01T23:09:03Z
"just  so  i  have    this  right      .   so  the  bank creates money  that is lent out    then  it gets it  back in  payments  plus interest  ,   does  it  have  to  pay  the  money back   to  the  central bank    and  keep  the  interest  as  a profit    ,  or   can  it  just  keep  it  all the money   . i  didnt  here  him  say  any thing   about  paying  it  back  the  the  central  bank    must  have  missed  that","Transaction, Payments and Accounts",2022-10-03T21:03:45Z
"*I'm struggling with how a bank can fail.*  If the money was only created when the loan was issued (i.e., created out of thin air - irrespective of deposits), then how does it suffer if the customer defaults?  In other words, if the money didn't exist before the loan was created then who is the bank liable to for any defaulted loans? Nobody? So how can it fail?
Can someone please explain? Thx.",Loans and Credit Services,2022-09-01T01:55:51Z
"Really interesting to see this video in 2022 with this hyperinflationary environment. I don't get something, in Romania banks are now giving a better rate on your deposit, than they receive on a credit for housing purposes. This contradicts what this video states","Transaction, Payments and Accounts",2022-08-18T19:43:11Z
"I'm confused by the new story. When I deposit money at the bank, I get that I'm getting a lower interest rate on that loan than I could get elsewhere. But how does that mean that I'm actually borrowing the same amount of money from the bank? It doesn't seem like I borrow anything from them, because they're not giving me anything right away that I agree to give back later.",Loans and Credit Services,2022-08-02T16:00:55Z
Can and/or does a bank create new money to pay their own employees?,Others,2022-07-18T13:14:53Z
"Your belief that Fractional reserve banking  is a myth is wrong itself.  The reason it is wrong is because new money created by the private banks is the same as new money created by the Reserve banks. The real facts are:-  We live in a system of FIAT CREDIT MONEY in almost all economies in the world today. 

The evidence of this is in the fact that money created by central banks is created in the same way as money created by private banks. It is all credit fiat money.
You should look at the explanations of the actual institutions who create new money to see how it is done. The Bank of England has it's clear explanation on their site.
You have said that researchers who work with banks have produced compelling evidence that contradicts the money multiplier BUT you have offered no evidence yourself of what their compelling evidence is. 
However you have offered a short explanation that says a bank owes the customer money and a customer owes the bank money.  This may be so but it ignores the fact that new fiat money has been created which did NOT previously exist.  That fact alone  means more money exists in the system than there was previously despite it being owed between two parties. . 
The very same effect is in operation when the reserve bank creates new money and lends it to the government to spend or anyone else.
 It is all new money created by the bank and lent which has to be paid back simply because it is fiat credit money like al of the sovereign money in countries today. 
  You also say the central bank creates cash. This is a gross exaggeration of the situation because cash is only a very very small percentage of money in todays economies. In some countries it is only 2% and in most less than 5%.  
It is a proven fact that some countries have NO RESERVE requirement at all and have operated this way for over 40 years. 
That alone should  to you that your explanation is wrong.  But it does not prove the concept of fractional reserve banking is wrong.  It only shows that banks being able to get more reserves for fractional reserve lending does mean action of bank lending more is not restricted.",Others,2022-07-15T06:38:41Z
Doesn’t the central bank give money but that comes in the cost of over night interest rates for reserve requirements in the deposit window. So the fed is not giving money as much as loaning the money overnight so they have a place to sleep for the night,Loans and Credit Services,2022-07-14T22:01:07Z
"What is the difference between the 7-8% loan/cash requirement, and the fractional reserve requirement? seems the same.",Loans and Credit Services,2022-06-20T08:55:52Z
Great video. Was the UK banking bailout funded by taxpayers or was the money created ?. In the US. The Head of The Federal Reserve confirmed the money for the bailout of AIG came from the Federal Reserve not US taxpayers. Was it the same in the UK ?.,Others,2022-06-07T07:09:03Z
So the banks still create money out of thin air and demand more of it back from the borrower.,Others,2022-06-04T19:47:34Z
"Great Video! Although one thing I don’t understand is why do define it as banks create money? Wouldn’t it be more correct to say that banks helps to speed up the circulation of money? The key difference is banks don’t have the ability to allow more money to simultaneously exist in the economy at one point in time right? Someone has to save for a loan to be made, simultaneously taking money out of the system and injecting it back into someone else who will actually spend it, thereby help circulate the existing money quicker. Banks cannot make another loan out unless someone saves again right? So from definition point of view, the only entity that truly creates more quantity of money that can be spent in the economy at the same time is through central banks creation of physical money and bank reserves no?",Others,2022-05-24T01:40:13Z
"that's not really much different than double entry accounting. 

Debit your cash, credit your liability, money is created from nothing. (and gets destroyed when you remove cash to pay liabilities.)",Loans and Credit Services,2022-05-06T01:59:07Z
"i love how this incorporates the facts of accounting in regards of bank and customer creating ""debt"" to each other.",Others,2022-04-24T22:27:08Z
"Great video! Just discovered your channel and the content is great. Pardon my ignorance but it’s one thing to have the reserve ratio of the bank at 0, but the central bank still creates the £1 out of nothing and lends that to the bank to dispense. Doesn’t that £1 have to be paid back to the central back (crucially) with interest?…where does that interest come from? From what I understand it’s an impossible equation.
Many thanks for reading and your response.",Others,2022-04-17T18:20:36Z
"So Banks do not create money, but rather the Central Bank providing money to banks through repos. Central Banks are creating money, not private banks.",Others,2022-04-16T11:58:13Z
"if credit is used to pay debt, then where does the interest from the credit used to pay off the debt come from?
thereby there is somehow more credit used to pay off debt because creditors are expecting an interest in return, but someone elses debt is someone elses credit,
since if there is no interest there is little incentive to lend.",Loans and Credit Services,2022-03-14T22:30:21Z
"One thing I'd like to clear up is if you have deposits at a bank but no loan, does this count as a loan to the bank or not? If not, what does the bank do with the 'money'? I understand that your deposits are technically the property of the bank, although you can call on it at any time.",Loans and Credit Services,2022-02-28T00:02:33Z
"Its correct that the loan itself is made out of thin air, but when he is used to purchase a car, for instance, the car dealer must be paid. If the seller insists on cash payment, the borrower must withdraw the required amount from the bank (Bank A) that granted him the loan in bills and coins. This means the bank must either have that cash on hand or get it from the nearest central bank office. In the first case, it will have to debit its cash holdings. In the second case, it will have to debit its account at the central bank. If the car is purchased with a check drawn on Bank A, the seller will deposit the check with his bank (Bank B). Bank B will then present the check to Bank A for payment, and Bank A will debit its account at the central bank by the amount of the purchase and credit the same amount to Bank B’s account at the central bank. It is only after Bank B acknowledges that its account at the central bank has received the funds from Bank A that the transaction is considered complete","Transaction, Payments and Accounts",2022-02-03T23:24:46Z
"So banks get the net positive from getting loans at 0% out of tax payers and lending it out at 5%
The extra 5% was never printed so it ends up with banks getting ownership of local or foreign goods, as shares, real estate, art...
This is why they own everything",Loans and Credit Services,2022-01-26T13:25:53Z
@9:52 how does one bank's increased lending tank its stock price ?,Loans and Credit Services,2022-01-24T19:16:20Z
"Now you know how bank money creation works. But, is it dangerous? Check out my follow-up video here: https://youtu.be/90qZccMiW5s

Want to see more academic economic research on YouTube? Consider supporting the channel via: https://www.patreon.com/moneymacro or https://ko-fi.com/moneymacro",Others,2022-01-21T15:51:31Z
"Dr Joeri great video!
Quick Question:  Does this apply to other currencies too? Think inter-country change in reserve currencies like dollars? How is this system managed? 
Ex. Say a Builder from Germany is helping a firm in India build a large dam. The whole deal is being done in dollars. Now can the Indian banks - even the state-run banks (on behalf of the Indian firm) create credit in dollars by just sort of telling the German firm's banks to increase the credit in their accounts?  
If so, why are foreign reserves so important/ what role do they play? Is there a Fractional Reserve Limit on central banks for issuing credit in other currencies?",Loans and Credit Services,2022-01-21T05:05:03Z
"Basically, banks do not lend you 'money', they buy and sell securities/ IOUs created by the 'borrower' when they sign the agreement that allows the bank to create the funds/credit. Your signature creates a promissory note, an asset to the bank.
Professor Richard Werner explains this also very well.",Loans and Credit Services,2021-12-24T01:38:30Z
"How about no more fractional reserve banking altogether - which can be interpreted as banks stealing in a way.

Instead, when you deposit money you agree to it being locked for a certain time, during that time the banks can lend out that money probably for a fairly high rate. Therefore no money is created and no more speculative bubbles and crashes. I'm there's a lot to be ironed out but introducing money at a constant rate would lead to a far more stable economy.",Others,2021-12-19T15:00:03Z
"It actually makes a lot of sense that you don't really need private banks to have a minimum reserve %/amount. Since it's just a ledger at the bank, people can 'pull out their money' as much as they want and the bank/central bank can just say 'there's more where that came from'. 

It made me think that Depression-causing bank runs aren't really a problem anymore per se. More so that as you said, if no one wants to borrow because they are afraid of interest rates rising or their ability to pay it back etc., that's when you are actually in trouble. eg. if everyone started avoiding getting mortgages at these insane prices, the demand for owning houses would fall which in theory should push prices down until people start to feel ok getting mortgages again

Nice explanation Dr. Schasfoort!",Loans and Credit Services,2021-11-12T17:21:15Z
"Great video! 

Given this information, could you help me clarify these two questions?

1) What motivates banks to attract deposits? I think I understand that when a client moves deposits from bank A to bank B, it corresponds to an increase of B's reserves at the expense of A's reserves, which makes B overall less likely to need to borrow reserves from the central bank (or B can repay some of its current reserve loans). Is there anything else that makes it advantageous to attract deposits?

2) I read elsewhere that banks also create money when they buy bonds (in a similar way as when they make loans). Is that correct? Could you roughly characterize the types of money operations when banks actually create new money, and when they only transfer money?",Others,2021-11-07T20:54:15Z
"To complete the picture you should discuss how money gets destroyed.
It's often left out that when loans are repaid the reverse happens - money/credit that was initially created is now destroyed/removed from the economy.
What's left is the interest and whatever asset or enterprise the borrower purchased or created.",Loans and Credit Services,2021-11-06T19:32:08Z
