Sentence,entities,extracted_keywords
Senior Citizens Fixed Deposits The highest security and maximum returns on your investment fixed deposit account dedicated to Sri Lankan citizens over years of age offering the highest security and maximum returns on your investment,"[[""Senior Citizens Fixed Deposits"", ""PRODUCT"", 0, 30]]","['Senior Citizens', 'Fixed Deposits']"
"Kapruka Credit Scheme, Coconut Development Loan Scheme,NCRCS New Comprehensive Rural Credit Scheme ,NCRCS Friends II Credit Scheme under Environmentally Friendly Solution ","[[""Kapruka Credit Scheme"", ""PRODUCT"", 0, 21], [""Coconut Development Loan Scheme"", ""PRODUCT"", 23, 54], [""NCRCS New Comprehensive Rural Credit Scheme"", ""PRODUCT"", 55, 98]]","['Kapruka Credit Scheme', 'Rural Credit Scheme', 'NCRCS Friends II Credit Scheme', 'Coconut Development Loan Scheme']"
Fund Siriliya Saviya Credit scheme to finance income generating projects for women ,"[[""Siriliya Saviya Credit scheme"", ""PRODUCT"", 5, 34]]",['Siriliya Saviya Credit scheme']
BOC Mithuru Uplifting the living standard of the community ,"[[""BOC Mithuru"", ""PRODUCT"", 0, 11]]","['BOC Mithuru', 'community']"
SMELoC Tea Smallholder Credit Line Tea Smallholder Credit Line ,"[[""SMELoC Tea Smallholder Credit Line"", ""PRODUCT"", 0, 34]]","['SMELoC Tea Smallholder Credit Line', 'Tea']"
JFPR Component to increase tea leaf production by way of new planting replanting infilling nursery development irrig Sashreeka Special Loan Scheme to support the local Organic Fertilizer Pesticides and Herbicides Manufacturers ,"[[""JFPR Component"", ""ORG"", 0, 14], [""Sashreeka Special Loan Scheme"", ""PRODUCT"", 117, 146]]","['tea leaf production', 'Sashreeka Special Loan Scheme', 'JFPR']"
MSME Financial Assistance for Development of Priority Sectors Micro Small and Medium Enterprise MSME SME Energizer ,"[[""MSME Financial Assistance"", ""SERVICE"", 0, 25],[""Micro Small and Medium Enterprise"",""ORG"",62,95],[""MSME"",""ORG"",96,100], [""SME"", ""ORG"", 101, 104]]","['MSME Financial', 'Medium Enterprise', 'Priority Sectors', 'SME']"
SME Online loan from your phone Pledge Facilities for Purchasing of Harvesting Commodities ,"[[""SME"",""ORG"",0,3]]","['SME', 'Online loan', 'Harvesting Commodities']"
BOC Youth Loan for Dream SMILE ,"[[""BOC Youth Loan"", ""PRODUCT"", 0, 14], [""Dream SMILE"", ""PRODUCT"", 19, 30]]","['BOC Youth', 'Dream SMILE', 'Youth']"
Entrepreneur Promotion Project Revolving Fund SMILE III RF Divi Udana Development Loans Scheme ,"[[""SMILE III RF Divi Udana Development Loans Scheme"", ""PRODUCT"", 46, 94]]","['Development Loans', 'SMILE III RF Divi Udana Development Loans Scheme', 'Udana Development']"
Our Fixed Deposit allows you to deposit your money securely for set period of time to earn higher returns on your savings by offering you the most competitive fixed deposit rates in Sri Lanka,"[[""Fixed Deposit"", ""PRODUCT"", 4, 17], [""Sri Lanka"", ""GPE"", 182, 191]]","['Fixed Deposit', 'deposit rates']"
BOC Flexi Investor is goalbased investment account offered to achieve your targets in the way you desire,"[[""BOC Flexi Investor"", ""PRODUCT"", 0, 18]]"," ['goal-based investment', 'Flexi Investor', 'BOC Flexi Investor', 'BOC']"
Welcome to the world of BOC Credit Cards where your financial journey intersects with limitless opportunities ,"[[""BOC Credit Cards"", ""PRODUCT"", 24, 40]]"," ['BOC Credit Cards', 'Credit Cards']"
Kantha Ran Ginum BOC Smart Online Banking facility BApp Valid until conditions apply ,"[[""Kantha Ran Ginum"", ""PRODUCT"", 0, 16], [""BOC Smart Online Banking"", ""SERVICE"", 17, 41]]","['Kantha Ran Ginum', 'BOC Smart', 'Online Banking', 'Banking Facility']"
Russel Fonseka joined the Bank of Ceylon in In his tenure of over years in the Bank ,"[[""Russel Fonseka"", ""PERSON"", 0, 14], [""Bank of Ceylon"", ""ORG"", 26, 40]]","['Russel Fonseka', 'Bank of Ceylon']"
BOC Premier Banking Centre,"[[""BOC Premier Banking Centre"", ""ORG"", 0, 26]]","['Premier Banking', 'Banking Centre', 'BOC Premier']"
LOCAL Thuru Green Savings ,"[[""Thuru Green Savings"", ""PRODUCT"", 6, 25]]","['Thuru Green Savings', 'Green Savings']"
Ran Ulpatha BOC Savings Digitally enabled for your convenience ,"[[""Ran Ulpatha BOC Savings"", ""PRODUCT"", 0, 23]]","['BOC Savings', 'Ran Ulpatha BOC Savings', 'Savings Digitally']"
BOC Senior Citizens Savings Kantha Ran Ginum My World My Way,"[[""BOC Senior Citizens Savings"", ""PRODUCT"", 0, 27], [""Kantha Ran Ginum"", ""PRODUCT"", 28, 44]]","['Senior Citizens Savings', 'BOC Senior Citizens Savings', 'Kantha Ran Ginum', 'BOC']"
Help your child achieve their future dreams today with Ran Kekulu Smart Account the best Children savings account in Sri Lanka by BOC,"[[""Ran Kekulu Smart Account"", ""PRODUCT"", 55, 79]]","['Ran Kekulu Smart Account', 'Children Savings', 'BOC']"
All inclusive Credit Packages with CapEx Working Capital Financing Credit packages for your growth ,"[[""CapEx Working Capital Financing Credit"", ""SERVICE"", 35, 73]]","['Credit Packages', 'CapEx Working Capital', 'Financing Credit']"
The Safe Deposit Locker facility is one of the value added services provided by the BOC to keep your valuable belongings and documents safe and secure Features ,"[[""Safe Deposit Locker"", ""PRODUCT"", 4, 23], [""BOC"", ""ORG"", 84, 87]]","['Deposit Locker', 'BOC', 'Locker facility']"
Foreign Currency Fixed Deposits,"[[""Foreign Currency Fixed Deposits"", ""PRODUCT"", 0, 31]]"," ['Foreign Currency', 'Fixed Deposits', 'Currency Deposits']"
Purpose ROI Fixed Special Loan Scheme for Purchasing of Solar Power System,"[[""Special Loan Scheme"", ""PRODUCT"", 18, 37]]","['Special Loan Scheme', 'Solar Power System', 'Loan Scheme']"
BOC net Facility Internet and Mobile Banking Facility BOC Smart Online Banking Corporate Version provides total online banking solution for corporate customers Services ,"[[""BOC net Facility"", ""SERVICE"", 0, 16],[""Internet and Mobile Banking Facility "",""SERVICE"",17,53], [""BOC Smart Online Banking"", ""SERVICE"", 54, 78]]","['Online Banking', 'Mobile Banking', 'BOC Smart Online Banking', 'BOC Smart']"
The Best Corporate Bank Account in Sri Lanka As business you need to have the assurance that your financial needs can be met with ease and convenience and no hassle ,"[[""Corporate Bank Account"", ""PRODUCT"", 9, 31]]","['Corporate Bank Account', 'Sri Lanka', 'Bank Account']"
Special loan scheme for sustainable energy and ecofriendly products,"[[""Special Loan Scheme"", ""PRODUCT"", 0, 19]]","['Special Loan Scheme', 'sustainable energy', 'ecofriendly products']"
Secure Your Child Future With Ran Kekulu Smart the Best Children Savings Account in Sri Lanka by BOC ,"[[""Ran Kekulu Smart"", ""PRODUCT"", 30, 46], [""Sri Lanka"", ""GPE"", 84, 93], [""BOC"", ""ORG"", 97, 100]]","['Children Savings', 'Savings Account', 'Ran Kekulu Smart']"
BOC has extended Portfolio Management Services PMS to range of clients including high networth individuals corporates and funds through BOC Investment Banking ,"[[""Portfolio Management Services"", ""SERVICE"", 17, 46], [""PMS"", ""SERVICE"", 47, 50], [""BOC Investment Banking"", ""SERVICE"", 136, 158]]","['BOC Investment', 'Portfolio Management Services' ,'PMS', 'BOC Investment Banking']"
BOC Haritha Kekulu account Secure your child future with financial stability together with safe environment ,"[[""BOC Haritha Kekulu"", ""PRODUCT"", 0, 18]]","['BOC Haritha Kekulu', 'child future', 'Secure']"
Personal Current Accounts Time Deposits,"[[""Personal Current Accounts"",""PRODUCT"",0,25]]","['Personal Current Accounts', 'Time Deposits']"
BOC Special Vehicle Leasing Scheme for Professionals ,"[[""BOC Special Vehicle Leasing Scheme"", ""PRODUCT"", 0, 38]]","['Vehicle Leasing', 'BOC Special Vehicle Leasing Scheme', 'BOC']"
Bank of Ceylon has fullyfledged comprehensive Sustainability Policy which is reviewed annually by the sustainability unit ,"[[""Bank of Ceylon"", ""ORG"", 0, 14], [""annually"", ""DATE"", 86, 94]]","['Sustainability Policy', 'Bank of Ceylon', 'Sustainability']"
The Ran Kekulu Smart Children Savings Account offers many benefits ,"[[""Ran Kekulu Smart Children Savings Account"", ""PRODUCT"", 4, 45]]","['Children Savings', 'Ran Kekulu Smart Children Savings Account']"
App It your convenient power tool in hand for mobile banking,"[[""mobile banking"",""SERVICE"",46,60]]",['mobile banking']
Trade smarter with BOC Trade Services ,"[[""BOC Trade Services"", ""SERVICE"", 19, 37]]","['BOC Trade Services', 'BOC']"
Bank of Ceylon Premier Banking offers you highly personalised experience designed exclusively for private banking customers,"[[""Bank of Ceylon Premier Banking"", ""SERVICE"", 0, 30]]","['private banking', 'Bank of Ceylon', 'Premier Banking', 'Bank of Ceylon Premier Banking']"
BOC Kantha Ran Ginum Card ,"[[""BOC Kantha Ran Ginum Card"", ""PRODUCT"", 0, 25]]","['BOC Kantha Ran Ginum Card', 'BOC']"
BOC Personal Loans for Members of professional bodies,"[[""BOC Personal Loans"", ""PRODUCT"", 0, 18]]","['Personal Loans', 'BOC Personal Loans', 'BOC']"
My Health Savings Scheme Putting your health first ,"[[""My Health Savings Scheme"", ""PRODUCT"", 0, 2]]","['Health Savings', 'My Health Savings Scheme']"
Abhimana Retirement Scheme Secure your future,"[[""Abhimana Retirement Scheme"", ""PRODUCT"", 0, 26]]","['Abhimana Retirement Scheme', 'Retirement']"
 Smart Lady Investment Account Inspire your goals Smart Investor Wise Investment to fulfill your hopes ,"[[""Smart Lady Investment Account"", ""PRODUCT"", 0, 30], [""Smart Investor Wise Investment"", ""PRODUCT"", 50, 80]]","['Smart Investor', 'Smart Investor Wise Investment', 'Smart Lady Investment Account']"
Tea Smallholder Credit Line to increase tea leaf production by way of new planting replanting infilling nursery development,"[[""Tea Smallholder Credit Line"", ""PRODUCT"", 0, 27]]","['tea leaf', 'Tea Smallholder Credit Line']"
Normal Savings Debit Card ,"[[""Normal Savings Debit Card"", ""PRODUCT"", 0, 25]]","['Debit Card', 'Normal Savings Debit Card']"
The next generation of savings accounts offers customers wide array of services to enjoy the speed and convenience of banking with Bank of Ceylon Account,"[[""Bank of Ceylon"", ""ORG"", 131, 145]]","['savings accounts', 'Bank of Ceylon']"
Purchase build or renovate your home with housing loans from BOC offered at favourable housing loan interest rates in the market ,"[[""housing loans"",""PRODUCT"",42,55],[""BOC"", ""ORG"", 61, 64]]","['housing loan', 'BOC']"
Bank of Ceylon has fullyfledged comprehensive Sustainability Policy which is reviewed annually by the sustainability unit,"[[""Bank of Ceylon"", ""ORG"", 0, 14]]","['Bank of Ceylon', 'comprehensive Sustainability', 'Sustainability Bank']"
BOC Smart Salary Saver account is special product dedicated for salaried individuals to manage their hard earnings with multitude of convenient banking facilities ,"[[""BOC Smart Salary Saver"", ""PRODUCT"", 0, 22]]","['BOC', 'BOC Smart Salary Saver']"
Bank of Ceylon holds the authority to change add or revise any condition term or statement in this facility,"[[""Bank of Ceylon"", ""ORG"", 0, 14]]",['Bank of Ceylon']
Animal Husbandry Business Loans In Sri Lanka offer wide range of business loans in Sri Lanka covering diverse sectors and needs from agriculture to fisheries,"[[""Business Loans"",""PRODUCT"",17,31],[""Sri Lanka"", ""GPE"", 35, 44], [""Sri Lanka"", ""GPE"", 83, 92]]","['Business Loans', 'Loans', 'Animal Husbandry']"
BOC META Banking Typically replies within seconds,"[[""BOC META Banking"", ""SERVICE"", 0, 16]]","['Banking', 'BOC META Banking']"
Herbicides Manufacturers SLOFPHM SME Circle Where your plans progress day by day ,"[[""Herbicides Manufacturers"", ""ORG"", 0, 24], [""SLOFPHM SME Circle"", ""ORG"", 25, 43]]","['Herbicides Manufacturers', 'Manufacturers SLOFPHM', 'Herbicides']"
BOC RanLiya loan to empower the Entrepreneur in her NanaJaya Scholarships for SMARTGEN Achievers Conquer tomorrow as an achiever ,"[[""BOC RanLiya loan"", ""PRODUCT"", 0, 16], [""tomorrow"", ""DATE"", 105, 113]]","['Entrepreneur', 'RanLiya loan', 'NanaJaya Scholarships', 'BOC']"
Manusavi Loan Scheme For Sri Lankan Migrant Workers,"[[""Manusavi Loan Scheme"", ""PRODUCT"", 0, 20]]","['Manusavi Loan Scheme', 'Migrant Workers']"
BOC Debit Card is revolutionary form of cash that allows customers to access their bank account around the world ,"[[""BOC Debit Card"", ""PRODUCT"", 0, 14]]","['Debit Card', 'BOC', 'BOC Debit Card']"
The Investment Banking Division of BOC is geared to help you manage your portfolio with basket of highly secure instruments ,"[[""Investment Banking Division"", ""ORG"", 4, 31], [""BOC"", ""ORG"", 35, 38]]","['Investment Banking', 'BOC']"
BOC Prestige Plus Personal Current Account is designed exclusively to feed the dynamic needs of demanding professionals and busy executives packed with offering host of convenient features and benefits to suit their lifestyles,"[[""BOC Prestige Plus Personal Current Account"", ""PRODUCT"", 0, 42]]","['BOC Prestige', 'BOC Prestige Plus Personal Current Account']"
Tea Smallholder Loan Scheme Empowering Small Scale Tea Estate Holders,"[[""Tea Smallholder Loan Scheme"", ""PRODUCT"", 0, 27]]","['Smallholder Loan', 'Tea Smallholder Loan Scheme', 'Tea Estate']"
Ran Surekum Naya Seva,"[[""Ran Surekum Naya Seva"", ""PRODUCT"", 0, 21]]",['Ran Surekum Naya Seva']
Do What You Want To Do Achieve Your Dreams With BOC Personal Loan,"[[""BOC Personal Loan"", ""ORG"", 48, 65]]","['Personal Loan', 'Loan', 'BOC']"
BOC Housing Loan Scheme For your dream Housing Loan for University Staff Housing Loan Scheme for the Permanent Cadre Employees,"[[""BOC Housing Loan Scheme"", ""PRODUCT"", 0, 23]]","['BOC Housing Loan Scheme', 'Housing Loan', 'BOC']"
Special Credit Scheme for Purchasing of Solar Power Systems,"[[""Special Credit Scheme"", ""PRODUCT"", 0, 21]]","['Solar Power','Special Credit Scheme']"
Convenient Machinery Vehicle Leasing in Sri Lanka with BOC,"[[""Sri Lanka"", ""GPE"", 40, 49], [""BOC"", ""ORG"", 55, 58]]","['Vehicle Leasing', 'BOC']"
Jayashantha was appointed to the Corporate Management of the Bank in marking the commencement of distinguished career within the institution ,"[[""the Corporate Management of the Bank"", ""ORG"", 29, 65]]","['Corporate Management', 'appointed']"
BOC World Master Card,"[[""BOC World Master Card"", ""PRODUCT"", 0, 21]]","['Master Card', 'BOC World Master Card', 'BOC']"
BOC multi currency travel card for all your expenses while travelling overseas without the hassle of carrying cash and cheques ,"[[""BOC multi currency travel card"", ""PRODUCT"", 0, 30]]","['travel card', 'BOC multi currency travel card', 'BOC']"
Domestic Foreign Currency Deposits Maximize Returns with FC Deposits,"[[""Domestic Foreign Currency Deposits"", ""SERVICE"", 0, 34], [""FC Deposits"", ""PRODUCT"", 57, 68]]","['Currency Deposits', 'Foreign Currency', 'FC Deposits']"
Bank of Ceylon unveiled BOC Haritha Kekulu Savings Scheme for children in the age of years with the objective of encouraging the future generation of our nation to think green and be ecofriendly ,"[[""Bank of Ceylon"", ""ORG"", 0, 14], [""BOC Haritha Kekulu Savings Scheme"", ""PRODUCT"", 24, 57]]","['Bank of Ceylon', 'BOC Haritha Kekulu Savings Scheme']"
BOC Senior Citizens Savings,"[[""BOC Senior Citizens Savings"", ""PRODUCT"", 0, 27]]","['Senior Citizens', 'BOC', 'BOC Senior Citizens Savings']"
The Ran Kekulu Smart Children Savings Account offers many benefits,"[[""Ran Kekulu Smart Children Savings Account"", ""PRODUCT"", 4, 45]]","['Children Savings', 'Ran Kekulu Smart Children Savings Account']"
BOC Personal Loan,"[[""BOC Personal Loan"", ""PRODUCT"", 0, 17]]","['Personal Loan', 'BOC Personal Loan', 'BOC']"
BOC Smart Freelancer,"[[""BOC Smart Freelancer"", ""PRODUCT"", 0, 20]]","['BOC Smart Freelancer', 'BOC']"
Special laptop loan for university students,"[[""Special laptop loan"", ""PRODUCT"", 0, 19]]","['laptop loan', 'Special laptop laon', 'university students']"
Housing Loan for University Staff Quantum of the Loan Facility Conditions Apply,"[[""Housing Loan"", ""PRODUCT"", 0, 12]]",['Housing Loan']
Machinery Vehicle Leasing in Sri Lanka with BOC ,"[[""Machinery Vehicle Leasing"", ""PRODUCT"", 0, 25], [""Sri Lanka"", ""GPE"", 29, 38], [""BOC"", ""ORG"", 44, 47]]","['Vehicle Leasing', 'BOC']"
BOC Thuru Green Savings Account is Sustainable Deposit Scheme introduced by Bank of Ceylon enabling the individuals and institutions to contribute towards environmentfriendly initiatives whilst gaining the maximum benefits for savings ,"[[""BOC Thuru Green Savings Account"", ""PRODUCT"", 0, 31], [""Sustainable Deposit Scheme"", ""PRODUCT"", 35, 61]]","['Green Savings', 'Sustainable Deposit','BOC Thuru Green Savings Account']"
The Bank of Ceylon BOC trailblazer in empowering Sri Lanka youth is inviting applications for the Nanajaya Scholarship as part of its plans of nurturing future leaders ,"[[""The Bank of Ceylon"", ""ORG"", 0, 18], [""Sri Lanka"", ""GPE"", 49, 58], [""the Nanajaya Scholarship"", ""PRODUCT"", 94, 118]]","['Nanajaya Scholarship', 'Scholarship', 'Bank of Ceylon']"
Ajith Karunarathne was appointed to the Corporate Management cadre in and assumed his duties as the Deputy General Manager Product Banking Development and then as the Deputy General Manager Recovery Provinces,"[[""Ajith Karunarathne"", ""PERSON"", 0, 18]]","['General Manager', 'Product Banking Development']"
BOC Housing Loan Scheme Purchase land construct house later Purchase land construct house Construct house land owned borrowers Purchase house partly constructed house condominium unit Complete construction renovation extension repair existing house condominium unit Landscaping interior decoration existing house condominium unit Construction houses apartments sale Please contact relevant branch information,"[[""BOC Housing Loan Scheme"", ""ORG"", 0, 23], [""Purchase"", ""PERSON"", 60, 68], [""Construct"", ""ORG"", 90, 99], [""Purchase"", ""PERSON"", 127, 135], [""Complete"", ""PERSON"", 184, 192], [""house"", ""ORG"", 243, 248], [""Landscaping"", ""PERSON"", 266, 277], [""house condominium unit Construction"", ""ORG"", 307, 342]]","['BOC Housing', 'Purchase house', 'Housing Loan', 'house Construct', 'existing house']"
"With the increasing demand for housing loans, Citizens Development Business Finance offers a variety of loans to suit your needs. The initiative was led by Nihal Fonseka from Sri Lanka Stock Exchange.","[[""Citizens Development Business Finance"", ""ORG"", 46, 83], [""Nihal Fonseka"", ""ORG"", 156, 169], [""Sri Lanka Stock Exchange"", ""ORG"", 175, 199]]","['housing loans', 'loans', 'Development']"
"To secure a business loans, Pan Asia Bank offers easy documentation and quick loan processing. The initiative was led by Ranjith Siyambalapitiya from Sri Lanka Central Bank.","[[""Pan Asia Bank"", ""ORG"", 28, 41], [""Ranjith Siyambalapitiya"", ""PERSON"", 121, 144], [""Sri Lanka Central Bank"", ""ORG"", 150, 172]]","['business loans', 'Pan Asia Bank']"
The interest rates offered by banks like Lanka Orix Leasing Company are competitive for savings accounts. The initiative was led by Nihal Fonseka from Institute of Bankers of Sri Lanka.,"[[""Lanka Orix Leasing Company"", ""ORG"", 41, 67], [""Nihal Fonseka"", ""ORG"", 132, 145], [""Institute of Bankers"", ""ORG"", 151, 171], [""Sri Lanka"", ""GPE"", 175, 184]]","['Lanka Orix Leasing Company', 'Leasing', 'interest rates']"
"Amana Bank offers a range of financial services, including savings accounts, loans, and investment options. The initiative was led by Chamila Gamage from Sri Lanka Stock Exchange.","[[""Amana Bank"", ""ORG"", 0, 10], [""Chamila Gamage"", ""PERSON"", 134, 148], [""Sri Lanka Stock Exchange"", ""ORG"", 154, 178]]","['Amana Bank', 'financial services', 'savings accounts','loans','investment']"
"Sampath Bank offers a range of financial services, including savings accounts, loans, and investment options. The initiative was led by Chamila Gamage from Institute of Bankers of Sri Lanka.","[[""Sampath Bank"", ""ORG"", 0, 12], [""Chamila Gamage"", ""ORG"", 136, 150], [""Institute of Bankers"", ""ORG"", 156, 176], [""Sri Lanka"", ""GPE"", 180, 189]]","['Sampath Bank', 'financial services', 'loans']"
"To secure a housing loans, Sri Lanka Development Bonds offers easy documentation and quick loan processing. The initiative was led by Anusha Dissanayake from Institute of Bankers of Sri Lanka.","[[""Sri Lanka Development Bonds"", ""ORG"", 27, 54], [""Anusha Dissanayake"", ""PERSON"", 134, 152], [""Institute of Bankers"", ""ORG"", 158, 178], [""Sri Lanka"", ""GPE"", 182, 191]]","['Development Bonds', 'housing loans', 'loans']"
"Commercial Bank of Ceylon offers a range of financial services, including savings accounts, loans, and investment options. The initiative was led by Nihal Fonseka from Institute of Bankers of Sri Lanka.","[[""Commercial Bank of Ceylon"", ""ORG"", 0, 25], [""Nihal Fonseka"", ""ORG"", 149, 162], [""Institute of Bankers"", ""ORG"", 168, 188], [""Sri Lanka"", ""GPE"", 192, 201]]","['financial services', 'Commercial Bank']"
"With the increasing demand for personal loans, Pan Asia Bank offers a variety of loans to suit your needs. The initiative was led by Chamila Gamage from Ceylon Chamber of Commerce.","[[""Pan Asia Bank"", ""ORG"", 47, 60], [""Chamila Gamage"", ""PERSON"", 133, 147], [""Ceylon Chamber of Commerce"", ""ORG"", 153, 179]]","['personal loans', 'loans', 'Pan Asia Bank']"
"Through its mobile banking services, Lanka Orix Leasing Company allows customers to manage accounts and transfer funds effortlessly. The initiative was led by Chamila Gamage from Institute of Bankers of Sri Lanka.","[[""Lanka Orix Leasing Company"", ""ORG"", 37, 63], [""Chamila Gamage"", ""ORG"", 159, 173], [""Institute of Bankers"", ""ORG"", 179, 199], [""Sri Lanka"", ""GPE"", 203, 212]]","['Orix Leasing','mobile banking', 'Lanka Orix Leasing Company']"
"To secure a housing loans, Union Bank offers easy documentation and quick loan processing. The initiative was led by Anusha Dissanayake from Institute of Bankers of Sri Lanka.","[[""Union Bank"", ""ORG"", 27, 37], [""Anusha Dissanayake"", ""PERSON"", 117, 135], [""Institute of Bankers"", ""ORG"", 141, 161], [""Sri Lanka"", ""GPE"", 165, 174]]","['Union Bank','housing loans']"
"Through its mobile banking services, Sri Lanka Savings Bank allows customers to manage accounts and transfer funds effortlessly. The initiative was led by Hiran Piyasena from Ceylon Chamber of Commerce.","[[""Sri Lanka Savings Bank"", ""ORG"", 37, 59], [""Hiran Piyasena"", ""PERSON"", 155, 169], [""Ceylon Chamber of Commerce"", ""ORG"", 175, 201]]","['mobile banking', 'Sri Lanka Savings Bank', 'banking services']"
"Through its mobile banking services, Sri Lanka Savings Bank allows customers to manage accounts and transfer funds effortlessly. The initiative was led by Sanjaya Wijesiri from Institute of Bankers of Sri Lanka.","[[""Sri Lanka Savings Bank"", ""ORG"", 37, 59], [""Sanjaya Wijesiri"", ""PERSON"", 155, 171], [""Institute of Bankers"", ""ORG"", 177, 197], [""Sri Lanka"", ""GPE"", 201, 210]]","['mobile banking', 'Sri Lanka Savings Bank']"
"Through its mobile banking services, Sevanatha Urban Development Bank allows customers to manage accounts and transfer funds effortlessly. The initiative was led by Anusha Dissanayake from Ceylon Chamber of Commerce.","[[""Sevanatha Urban Development Bank"", ""ORG"", 37, 69], [""Anusha Dissanayake"", ""PERSON"", 165, 183], [""Ceylon Chamber of Commerce"", ""ORG"", 189, 215]]","['Sevanatha Urban Development Bank', 'mobile banking']"
"To secure a housing loans, Sri Lanka Development Bonds offers easy documentation and quick loan processing. The initiative was led by Nihal Fonseka from Sri Lanka Stock Exchange.","[[""Sri Lanka Development Bonds"", ""ORG"", 27, 54], [""Nihal Fonseka"", ""ORG"", 134, 147], [""Sri Lanka Stock Exchange"", ""ORG"", 153, 177]]","['Sri Lanka Development Bonds', 'housing loans', 'Development', 'loans']"
"With the increasing demand for housing loans, National Development Bank offers a variety of loans to suit your needs. The initiative was led by Anusha Dissanayake from Sri Lanka Stock Exchange.","[[""National Development Bank"", ""ORG"", 46, 71], [""Anusha Dissanayake"", ""PERSON"", 144, 162], [""Sri Lanka Stock Exchange"", ""ORG"", 168, 192]]","['housing loans', 'loans', 'National Development Bank']"
"Through its mobile banking services, National Development Bank allows customers to manage accounts and transfer funds effortlessly. The initiative was led by Anusha Dissanayake from Institute of Bankers of Sri Lanka.","[[""National Development Bank"", ""ORG"", 37, 62], [""Anusha Dissanayake"", ""PERSON"", 158, 176], [""Institute of Bankers"", ""ORG"", 182, 202], [""Sri Lanka"", ""GPE"", 206, 215]]","['National Development Bank', 'mobile banking','banking services']"
"To secure a personal loans, Commercial Bank of Ceylon offers easy documentation and quick loan processing. The initiative was led by Hiran Piyasena from Ceylon Chamber of Commerce.","[[""Commercial Bank of Ceylon"", ""ORG"", 28, 53], [""Hiran Piyasena"", ""PERSON"", 133, 147], [""Ceylon Chamber of Commerce"", ""ORG"", 153, 179]]","['Commercial Bank of Ceylon', 'personal loans']"
"To secure a personal loans, Union Bank offers easy documentation and quick loan processing. The initiative was led by Rajiv Gooneratne from Sri Lanka Stock Exchange.","[[""Union Bank"", ""ORG"", 28, 38], [""Rajiv Gooneratne"", ""PERSON"", 118, 134], [""Sri Lanka Stock Exchange"", ""ORG"", 140, 164]]","['Union Bank', 'personal loans']"
The business loans rates at Bank of Ceylon are some of the lowest in Sri Lanka. The initiative was led by Anusha Dissanayake from Ceylon Chamber of Commerce.,"[[""Bank of Ceylon"", ""ORG"", 28, 42], [""Sri Lanka"", ""GPE"", 69, 78], [""Anusha Dissanayake"", ""PERSON"", 106, 124], [""Ceylon Chamber of Commerce"", ""ORG"", 130, 156]]","['business loans', 'loans rates', 'Bank of Ceylon']"
