Sentence,entities,extracted_keywords
Vibe Youth Fixed Deposits with special high interest rates are offered for you when you convert the balances in your matured Isuru Arunalu Accounts ,"[[""Isuru Arunalu Accounts"", ""PRODUCT"", 125, 147]]","['Fixed Deposits', ' Youth Fixed Deposits', 'Isuru Arunalu Accounts','interest']"
Gold Loans Pawning Months,"[[""Gold Loans"",""PRODUCT"",0,10]]","['Gold Loans', 'Pawning']"
Corporate Banking comes to you with advanced lending and deposit products with stateoftheart technology and unparalleled levels of customer service,"[[""Corporate Banking"",""SERVICE"",0,17]]","['Corporate Banking', 'technology']"
Sending money home has now become easier with MoneyGram,"[[""MoneyGram"", ""ORG"", 46, 55]]","['Sending money', 'MoneyGram']"
Enjoy lower interest rates Interest free installment schemes convenient settlement cycles Facility of settling credit card payments at over branches island wide,"[[""installment schemes"", ""PRODUCT"", 41, 60]]","['installment schemes', 'card payments', 'credit card']"
Foreign Currency Children Savings Account Save in foreign currency to ensure secure future for your child,"[[""Foreign Currency Children Savings Account"", ""PRODUCT"", 0, 41]]","['Children Savings', 'Foreign Currency Children Savings Account', 'Foreign Currency', 'Savings Account']"
Premium Credit Cards,"[[""Premium Credit Cards"", ""PRODUCT"", 0, 20]]","['Credit Cards', 'Premium Credit Cards', 'Premium']"
You may also be interested in Dialog eZ Cash Unique service is available even without bank account ,"[[""eZ Cash"", ""PRODUCT"", 37, 44]]","['Dialog', 'eZ Cash', 'Dialog eZ Cash']"
Customer excellence is embedded as core element of Commercial Bank business strategy ,"[[""Commercial Bank"", ""ORG"", 51, 66]]","['Customer excellence', 'Bank business', 'Commercial Bank']"
You may also be interested in Divisaru Savings Account Savings Account for Micro Entrepreneurs,"[[""Divisaru Savings Account"", ""PRODUCT"", 30, 54]]","['Divisaru Savings Account', 'Savings Account', 'Divisaru Savings']"
If you are in need of physical cash or when family member or close friend of yours sends money through mCash now you can easily withdraw these funds through the nearest Commercial Bank ATM ,"[[""Commercial Bank"", ""ORG"", 169, 184], [""ATM"", ""PRODUCT"", 185, 188]]","['Commercial Bank', 'physical cash', 'mCash','ATM']"
Tracking the status of your RemitPlus remittance had never been so easy ,"[[""RemitPlus"",""PRODUCT"",28,37]]","['remittance', 'RemitPlus']"
Super Saver Account The higher you save the higher you earn Calculated daily paid monthly Personal Foreign Currency Account Add value to your earnings Regular Savings Account Maximum flexibility for your savings,"[[""Super Saver Account"", ""PRODUCT"", 0, 19],[""monthly"", ""DATE"", 82, 89],[""Regular Savings Account"", ""PRODUCT"", 151, 174]]","['Super Saver Account', 'Regular Savings', 'Regular Savings Account']"
The Credit Card holders will be eligible to earn ComBank Max Loyalty points and ComBank Max Loyalty Point for every spent Max Loyalty Point Rupee,"[[""Credit Card"", ""PRODUCT"", 4, 15], [""ComBank Max Loyalty Point"", ""PRODUCT"", 80, 105]]","['Loyalty Points', 'Credit Card', 'ComBank Max Loyalty Point']"
Deposits Foreign Currency Deposits Forex Plus Earn much more than an interest for your foreign currency ,"[[""Forex Plus"", ""PRODUCT"", 35, 45]]","['Currency Deposits', 'Forex Plus', 'Foreign Currency']"
Attend exclusive outings hosted by MasterCard golf ambassadors at renowned golf courses,"[[""MasterCard"", ""PRODUCT"", 35, 45]]","['golf ambassadors', 'MasterCard', 'golf']"
Investment securities issued by the Central Bank of Sri Lanka through primary auctions held throughout the year,"[[""Central Bank of Sri Lanka"", ""ORG"", 36, 61]]","['Investment securities', 'Central Bank of Sri Lanka', 'securities','Investment']"
The DFCC Club and Society Plus offers you bundled benefits that help you navigate the realms of finance with ease while empowering the goals of your club society or association,"[[""The DFCC Club"", ""ORG"", 0, 13]]","['DFCC Club', 'Society Plus']"
The account opened under the DFCC Freelancer category will be eligible for the following propositions of the bank based on below monthly income Proposition Amount Equivalent ,"[[""DFCC"", ""ORG"", 29, 33],[""monthly"", ""DATE"", 129, 136]]","['DFCC', 'Freelancer category']"
Clients can process their vendor supplier payments via file upload or adhoc single payment through DFCC iConnect ,"[[""DFCC iConnect"", ""PRODUCT"", 99, 112]]","['supplier payments', 'DFCC iConnect']"
Local Payments Clients can outsource their entire cheque printing and delivery operation to DFCC through iConnect or has the flexibility of printing the cheques at their premises ,"[[""DFCC"", ""ORG"", 92, 96], [""iConnect"", ""PRODUCT"", 105, 113]]","['Local Payments', 'cheque', 'iConnect', 'DFCC']"
Founded in DFCC Bank is one of the oldest development banks in Asia,"[[""DFCC Bank"", ""ORG"", 11, 20], [""Asia"", ""GPE"", 63, 67]]","['development banks', 'DFCC Bank']"
DFCC Bank Foreign Currency Accounts offer you the opportunity to save your personal foreign exchange or business foreign exchange and earn interest in the same currency,"[[""DFCC Bank Foreign Currency Accounts"", ""PRODUCT"", 0, 35]]","['Currency Accounts', 'Foreign Currency', 'foreign exchange', 'DFCC Bank Foreign Currency Accounts']"
Corporate Credit Cards,"[[""Corporate Credit Cards"", ""PRODUCT"", 0, 22]]","['Credit Cards', 'Corporate Credit Cards']"
DFCC Bank provides nancial solutions to support individuals and businesses of all sizes offering both development banking and commercial banking facilities ,"[[""DFCC Bank"", ""ORG"", 0, 9]]","['DFCC Bank', 'development banking','DFCC', 'commercial banking facilities']"
DFCC Online Banking enables you to perform host of banking functions at the comfort of your home or office around the clock Be enabled with DFCC Online Banking today,"[[""DFCC Online Banking"", ""SERVICE"", 140, 159]]","['DFCC', 'Online Banking']"
"Travel with your DFCC Visa Signature,DFCC Visa Infinite or World Mastercard Credit Cards and experience host of exclusive offers at partner merchants worldwide","[[""Visa Infinite"", ""PRODUCT"", 42, 55], [""World Mastercard Credit Cards"", ""PRODUCT"", 59, 88]]","['DFCC', 'Visa Infinite', 'Mastercard Credit', 'World Mastercard Credit Cards']"
Special Home Loan packages available for selected condominium apartment projects to provide you the maximum benefits on your investment,"[[""Home Loan"", ""PRODUCT"", 8, 17]]","['Home Loan', 'Loan packages']"
Exclusive Visa Infinite privileges and worldwide offers,"[[""Visa Infinite"", ""PRODUCT"", 10, 23]]","['Visa', 'Visa Infinite', 'Infinite privileges']"
Branded Credit Cards with issuance and st Year Annual fee waived off DFCC Aloka has dedicated banking day for females every of the week Simply apply for DFCC Aloka debit or credit card facility to enjoy host of benefits around the year with offers from supermarket shopping clothing Dining online offers etc,"[[""Branded Credit Cards"", ""PRODUCT"", 0, 20], [""Year"", ""DATE"", 42, 46], [""DFCC Aloka"", ""PRODUCT"", 69, 79], [""the week"", ""DATE"", 127, 135], [""DFCC Aloka"", ""PRODUCT"", 153, 163], [""the year"", ""DATE"", 227, 235]]","['Credit Cards', 'DFCC Aloka', 'Branded Credit']"
Enjoy wide range of offers with Credit Card Offers,"[[""Credit Card Offers"", ""SERVICE"", 32, 50]]","['Card Offers', 'Credit Card']"
The Bank fitness initiative OMMM promotes healthy lifestyle for team members and families ,"[[""Bank"", ""ORG"", 4, 8],[""OMMM"",""SERVICE"",28,32]]","['OMMM', 'healthy lifestyle', 'fitness']"
Visa Signature Credit Card,"[[""Visa Signature Credit Card"", ""PRODUCT"", 0, 26]]","['Visa', 'Credit Card', 'Visa Signature Credit Card']"
DFCC Bank has clear vision and mission ensuring that its multidisciplinary team work in synergy to make DFCC the leading financial solutions provider sustainably,"[[""DFCC Bank"", ""ORG"", 0, 9], [""DFCC"", ""ORG"", 104, 108]]","['DFCC Bank', 'DFCC']"
We are pleased to announce that DFCC Visa Debit Card have been enhanced with brand new design and additional security in bid to improve your transacting experience,"[[""DFCC"",""ORG"",32,36],[""Visa Debit Card"", ""PRODUCT"", 37, 52]]","['Debit Card', 'DFCC', 'Visa']"
DFCC Bank launched DFCC iConnect cuttingedge Payments Solution for businesses,"[[""DFCC Bank"", ""ORG"", 0, 9], [""DFCC iConnect"", ""PRODUCT"", 19, 32]]","['DFCC Bank', 'DFCC iConnect', 'DFCC']"
DFCC Bank is committed to developing SMEs in the country,"[[""DFCC Bank"", ""ORG"", 0, 9]]","['DFCC Bank', 'SME']"
Travel Insurance and Emergency Accident Medical Expenses cover of up to from Allianz Insurance when you purchase return air ticket using your DFCC Visa Signature Credit Card DFCC World Mastercard Credit Card and DFCC Pinnacle In nite Credit Card,"[[""Allianz Insurance"", ""ORG"", 77, 94], [""DFCC Visa Signature Credit Card"",""PRODUCT"",142,173],[""DFCC World Mastercard Credit Card"",""PRODUCT"",174,207], [""DFCC Pinnacle"",""PRODUCT"",212,225]]","['Travel Insurance','DFCC Visa', 'Allianz Insurance', 'DFCC Visa Signature Credit Card', 'DFCC World Mastercard Credit Card', 'DFCC Pinnacle']"
Discounting usance bills under Import and Export Letters of Credit and Bills Avalized improving cash flow,"[[""Import and Export Letters of Credit"", ""PRODUCT"", 31, 66]]","['Import and Export Letters of Credit', 'cash flow', 'bills']"
Visa Signature Credit Card CashBack into your DFCC Bank account on every spend ,"[[""Visa Signature Credit Card"", ""PRODUCT"", 0, 26], [""DFCC Bank"", ""ORG"", 46, 55]]","['Visa Signature Credit Card', 'Bank account','DFCC Bank']"
DFCC Bank is part of an interconnected network stream that collaborates with Sri Lanka leading Banks enabling swift and secure transfers within the network Local payments are made possible via Sri Lanka Inter Bank Payment System SLIPS ,"[[""DFCC Bank"", ""ORG"", 0, 9], [""Sri Lanka"", ""GPE"", 77, 86], [""Banks"", ""ORG"", 95, 100], [""Sri Lanka Inter Bank Payment System"", ""SERVICE"", 193, 228]]","['DFCC Bank', 'Bank Payment', 'Sri Lanka Inter Bank Payment System', 'SLIPS']"
Save the money you earn using your talent your pocket money and cash gifts in DFCC Teen Account,"[[""DFCC Teen Account"",""PRODUCT"",78,95]]",['DFCC Teen Account']
Credit Cards Comparison Tool,"[[""Credit Cards"", ""PRODUCT"", 0, 12]]","['Credit Cards', 'Cards Comparison']"
 Enjoy Easy Payment Plans of up to months on travel furniture electronics and home appliances with no additional charges at leading merchants throughout the year,"[[""up to months"", ""DATE"", 29, 41], [""the year"", ""DATE"", 153, 161]]","['Easy Payment', 'Payment Plans']"
Features Bene ts DFCC affinity cards,"[[""DFCC affinity cards"", ""PRODUCT"", 17, 36]]","['DFCC affinity cards', 'DFCC']"
Your needs could vary from buying house providing for your child education getting your child married retirement and many more DFCC Bank investment planners cater for your all financial needs and help secure your future,"[[""DFCC Bank"", ""ORG"", 127, 136]]","['financial needs', 'DFCC Bank', 'Bank investment']"
Funds can be easily received or remitted out of Srilanka through our wide range of correspondent banking network acoross the Globe ,"[[""Srilanka"", ""GPE"", 48, 56]]","['Srilanka', 'correspondent banking']"
Foreign Currency Fixed Deposit Rates,"[[""Fixed Deposit"", ""PRODUCT"", 17, 30]]","['Deposit Rates', 'Foreign Currency', 'Fixed Deposit']"
Overdraft facility is offered to finance day to day working capital requirement up to an established limit You have the option to settle the overdraft on daily basis and interest will be charged only on usage Shrotterm loans are granted in the form of Revolving Nonrevolving loans that will finance short term working capital requirement,"[[""daily"", ""DATE"", 154, 159], [""Shrotterm loans"", ""PRODUCT"", 209, 224]]","['Overdraft facility', 'Nonrevolving loans', 'Shrotterm loans']"
DFCC acquired ABN AMRO Securities Pvt Limited and renamed the company to DFCC Stock Brokers Pvt Ltd,"[[""DFCC"", ""ORG"", 0, 4], [""ABN AMRO Securities Pvt Limited"", ""ORG"", 14, 45], [""DFCC Stock Brokers Pvt Ltd"", ""ORG"", 73, 99]]","['DFCC', 'stock ', 'AMRO']"
As pioneer pathfinder and trailblazer DFCC Bank has evolved expanded and kept pace with the ever changing needs of the customer and the nation,"[[""DFCC Bank"", ""ORG"", 38, 47]]",['DFCC Bank']
DFCC Credit Cards also allow you to save as you spend by earning CashBack on every transaction you make anywhere in the world,"[[""DFCC Credit Cards"", ""PRODUCT"", 0, 17]]","['DFCC Credit Cards', 'Credit Cards']"
High Interest tiered savings account As you increase the savings account balance maintained in the DFCC Aloka savings account you are able to earn higher rate of return Deposit Range Interest Rate ,"[[""DFCC Aloka"", ""PRODUCT"", 99, 109]]","['savings account', 'DFCC Aloka']"
Clients can submit Telegraphic Transfer TT payment instructions directly onto DFCC iConnect without having to visit any of the branches,"[[""Telegraphic Transfer"", ""SERVICE"", 19, 39], [""TT"", ""SERVICE"", 40, 42], [""DFCC iConnect"", ""PRODUCT"", 78, 91]]","['DFCC iConnect', 'Telegraphic Transfer']"
At DFCC we believe in continuous evolution and innovation to cater to the changing needs of the market ,"[[""DFCC"", ""ORG"", 3, 7]]","['innovation', 'DFCC']"
Commercial Bank of Ceylon ceased to be an Associate Company,"[[""Commercial Bank of Ceylon"", ""ORG"", 0, 25]]","['Commercial Bank', 'Associate Company']"
CEFT Transaction process to conduct TAX payments,"[[""CEFT Transaction"", ""SERVICE"", 0, 16]]","['TAX payments', 'CEFT Transaction']"
DFCC Consulting Pvt Limited ,"[[""DFCC Consulting Pvt Limited"", ""ORG"", 0, 27]]","['DFCC Consulting Pvt Limited', 'Consulting']"
DFCC Sustainability Trust was created in to carry out identified CSR Sustainability initiatives as proposed by the Board approved Sustainability Policy Strategy and Plan for DFCC ,"[[""DFCC Sustainability Trust"", ""SERVICE"", 0, 25]]","['DFCC Sustainability Trust', 'Sustainability']"
DFCC Bank new Sustainability Strategy is linked to SDGs,"[[""DFCC Bank"", ""ORG"", 0, 9]]","['Sustainability Strategy', 'DFCC Bank', 'Sustainability', 'DFCC']"
The online form now accommodates end to end digital account opening to jump start your saving habit with higher interest rates offered by DFCC Bank,"[[""DFCC Bank"", ""ORG"", 138, 147]]","['digital account', 'DFCC Bank']"
Clients can build in their current Authorisation Matrix as per their Board Resolutions into the DFCC iConnect system with any number of signature combinations and signature categories,"[[""DFCC iConnect"", ""PRODUCT"", 96, 109]]","['DFCC iConnect', 'DFCC']"
DFCC Affinity Credit Cards,"[[""DFCC Affinity Credit Cards"", ""PRODUCT"", 0, 26]]","['Credit Cards', 'DFCC Affinity Credit Cards', 'DFCC']"
DFCC bank commercial bank offers the best biggest and popular deals and number one promotions in sri lanka suiting your lifestyle needs,"[[""DFCC bank"", ""ORG"", 0, 9], [""commercial bank "",""ORG"",10,25]]","['DFCC bank', 'commercial bank']"
DFCC Bank PLC Legal Form Public Quoted Company incorporated under the Companies Act,"[[""DFCC Bank PLC"", ""ORG"", 0, 13]]","['Corporate Information', 'DFCC Bank']"
Current accounts can be operated through Internet Banking DFCC iConnect Accounts are available in both ,"[[""DFCC iConnect"",""PRODUCT"",58,71]]","['DFCC iConnect', 'Current accounts', 'Internet Banking']"
DFCC Bank also seeks to be Clean Air Champion in Sri Lanka and will work with organisations on local air pollution mitigation actions,"[[""DFCC Bank"", ""ORG"", 0, 9],[""Sri Lanka"", ""GPE"", 49, 58]]","['Clean Air', 'DFCC Bank', 'DFCC']"
The Bank believes that the best sustainability framework to adopt is the Triple Bottom Line TBL of People Planet and Profit the three Ps,"[[""Bank"", ""ORG"", 4, 8]]","['sustainability framework', 'sustainability']"
No special overseas spend limits are imposed on ATM PointofSale and commerce transactions ,"[[""ATM PointofSale"", ""PRODUCT"", 48, 63]]","['ATM PointofSale', 'transactions']"
Home loans could be obtained for We also provide three modes of payment Equated monthly installments where your capital plus interest is fixed sum ,"[[""Home loans"",""PRODUCT"",0,10]]","['Home loans', 'loans']"
DFCC Bank offers comprehensive range of Treasury products and services delivered by experienced and competent dealers who understand your needs ,"[[""DFCC Bank"", ""ORG"", 0, 9]]","['DFCC Bank', 'DFCC', 'Treasury products']"
Enjoy access to over airport lounges worldwide with complimentary annual membership with Lounge Key Free visits for DFCC Pinnacle Infinite cardholders per year Free visit for Signature DFCC Prestige and World Mastercard credit cardholders to any partner airport lounge worldwide,"[[""annual"", ""DATE"", 66, 72], [""DFCC Pinnacle Infinite"", ""PRODUCT"", 116, 138], [""World Mastercard"", ""PRODUCT"", 203, 219]]","['airport lounges','DFCC Pinnacle Infinite', 'World Mastercard']"
DFCC Prestige aims to help you to be in control and smoothly navigate through your financials to help you achieve your next goal ,"[[""DFCC Prestige"",""PRODUCT"",0,13]]","['DFCC Prestige', 'Prestige', 'DFCC']"
DFCC Bank PLC respects its customers right always to receive efficient service,"[[""DFCC Bank PLC"", ""ORG"", 0, 13]]","['DFCC Bank PLC', 'DFCC', 'efficient service']"
Manusavi loan scheme offered in collaboration with the Central Bank of Sri Lanka CBSL and the Sri Lanka Bureau of Foreign Employment SLBFE which provides loans for Sri Lankan Migrant Workers,"[[""Manusavi loan scheme"", ""PRODUCT"", 0, 20], [""Central Bank of Sri Lanka"", ""ORG"", 55, 80],[""CBSL"",""ORG"",81,85], [""Sri Lanka Bureau of Foreign Employment"", ""ORG"", 94, 132], [""SLBFE"",""ORG"",133,138]]","['loan scheme', 'Manusavi loan scheme','Central Bank of Sri Lanka', 'Sri Lanka Bureau of Foreign Employment']"
Clients can opt to pay their utility bills through DFCC iConnect ,"[[""DFCC iConnect"", ""PRODUCT"", 51, 64]]","['DFCC iConnect', 'utility bills', 'DFCC']"
This feature on iConnect allows clients to get their distributors and suppliers onto one platform for direct financing to be approved by the Bank clients and their distributors ,"[[""iConnect"", ""PRODUCT"", 16, 24], [""Bank"", ""ORG"", 141, 145]]","['iConnect', 'distributors']"
We offer wide range of Digital Channels which comprises of online banking DFCC ONE ATMs CDMs and MY Space Digital banking outlets,"[[""Digital Channels"", ""SERVICE"", 23, 39], [""DFCC"", ""ORG"", 74, 78],[""MY Space Digital"", ""PRODUCT"", 97, 113]]","['Digital Channels', 'Digital banking', 'DFCC']"
DFCC Bank relaunched DFCC Credit Cards with EMV enabled chip and Visa payWave contactless technology,"[[""DFCC Bank"", ""ORG"", 0, 9], [""DFCC Credit Cards"", ""PRODUCT"", 21, 38], [""EMV"", ""PRODUCT"", 44, 47], [""Visa"", ""PRODUCT"", 65, 69]]","['EMV','Visa', 'Credit Cards', 'DFCC Bank']"
DFCC acquired of MERC Bank,"[[""DFCC"", ""ORG"", 0, 4], [""MERC Bank"", ""ORG"", 17, 26]]","['DFCC', 'MERC Bank']"
flexi plan Automated Bill Settlements Introducing Automated Bill Settlement ABS with DFCC Credit Cards Spend time doing what you love Automate your bill payments,"[[""Automated Bill Settlements"", ""SERVICE"", 11, 37], [""DFCC Credit Cards"", ""PRODUCT"", 85, 102]]","['DFCC', 'Credit Cards', 'Automated Bill Settlements']"
DFCC Pinnacle Visa Infinite Credit Card with free lifetime subscription and exclusive benefits no annual fee or joining fee for you and your family,"[[""DFCC Pinnacle Visa Infinite Credit Card"", ""PRODUCT"", 0, 39]]","['Credit Card', 'Visa Infinite', 'DFCC Pinnacle Visa Infinite Credit Card']"
DFCC Bank was Sri Lanka pioneer development bank incorporated in under an Act of Parliament,"[[""DFCC Bank"", ""ORG"", 0, 9], [""Sri Lanka"", ""GPE"", 14, 23], [""Parliament"", ""ORG"", 81, 91]]","['development bank', 'DFCC Bank', 'DFCC']"
DFCC Group Find out the companies involved in forming the DFCC group,"[[""DFCC Group"", ""ORG"", 0, 10], [""DFCC"", ""ORG"", 58, 62]]","['DFCC Group', 'companies', 'DFCC']"
Travel with your DFCC Visa Signature Credit Card and experience host of exclusive offers at partner merchants worldwide,"[[""DFCC Visa Signature Credit Card"",""PRODUCT"",17,48]]","['Visa', 'DFCC Visa Signature Credit Card']"
Our Pinnacle Home Loans cater to the following needs,"[[""Pinnacle Home Loans"", ""ORG"", 4, 23]]","['Home Loans', 'Pinnacle Home Loans']"
All customers of DFCC Bank with online banking and DFCC iConnect facilities could conduct TAX payments to IRD via CEFT transactions by following the below process,"[[""DFCC Bank"", ""ORG"", 17, 26], [""DFCC iConnect"", ""PRODUCT"", 51, 64], [""IRD"", ""ORG"", 106, 109]]","['CEFT transactions', 'DFCC Bank','DFCC iConnect']"
DFCC World Mastercard CashBack into DFCC Bank account on every spend CashBack on overseas spend and CashBack on every local spend Cards with the latest Mastecard PayPass technology ,"[[""DFCC World Mastercard"", ""PRODUCT"", 0, 21], [""DFCC Bank"", ""ORG"", 36, 45]]","['DFCC World Mastercard', 'PayPass technology ']"
This solution creates unique digital account number that helps clients identify their payers automatically without having to depend on referencing ,"[[""digital account number"",""PRODUCT"",29,51]]",['digital account number']
To enjoy the features and benefits offered by DFCC Pinnacle you will need to fulfill any ONE of the below criteria,"[[""DFCC Pinnacle"", ""ORG"", 46, 59]]","['DFCC Pinnacle', 'DFCC']"
DFCC Bank offers you the highest Fixed Deposit FD rates in Sri Lanka to maximize earnings with utmost reliability and higher rate of interest for your hardearned savings Rates are subject to change based on market conditions in Sri Lanka,"[[""DFCC Bank"", ""ORG"", 0, 9], [""Fixed Deposit"", ""PRODUCT"", 33, 46], [""Sri Lanka"", ""GPE"", 59, 68], [""Sri Lanka"", ""GPE"", 228, 237]]","['Fixed Deposit', 'DFCC Bank', 'Deposit', 'FD rates']"
DFCC Alerts is facility which dispatches information of account transactions to customers via SMS or email ,"[[""DFCC Alerts"", ""PRODUCT"", 0, 11], [""SMS"", ""SERVICE"", 94, 97]]","['DFCC Alerts', 'Alerts']"
DFCC Pinnacle seamless private banking financial experience to reach new heights of success,"[[""DFCC Pinnacle"", ""ORG"", 0, 13]]","['private banking', 'DFCC Pinnacle', 'financial', 'banking']"
Manusavi Loan Scheme for Sri Lankan Migrant Workers MLSMW,"[[""Manusavi Loan Scheme"", ""PRODUCT"", 0, 20]]","['Manusavi Loan Scheme', 'Migrant Workers']"
This is the first ever Green Bond issuance in Sri Lanka which is to be listed in the Colombo Stock Exchange that benefits the Solar sector in the country,"[[""Green Bond"", ""PRODUCT"", 23, 33], [""Sri Lanka"", ""GPE"", 46, 55], [""the Colombo Stock Exchange"", ""ORG"", 81, 107], [""Solar"", ""PRODUCT"", 126, 131]]","['Green Bond', 'Colombo Stock Exchange', 'Sri Lanka']"
Our portfolio consists of development loans and such lending contributes significantly to the growth of the economy whilst we continue to expand our commercial banking business,"[[""development loans"",""PRODUCT"",26,43]]","['development loans', 'commercial banking']"
Pump fuel by using cashback Credit Card issued by DFCC Cobranded with Lanka IOC,"[[""Credit Card"", ""ORG"", 28, 39], [""DFCC"", ""ORG"", 50, 54], [""Lanka IOC"", ""ORG"", 70, 79]]","['Lanka IOC', 'fuel', 'Credit Card', 'DFCC']"
Established in DFCC Consulting Pvt Limited is fullyowned subsidiary that engages in project consultancy and related fields,"[[""DFCC Consulting Pvt Limited"", ""ORG"", 15, 42]]","['Consulting', 'DFCC Consulting Pvt Limited']"
By simply saving with DFCC Aloka savings account You are eligible to claim the following rewards of DFCC Gift Certificates by maintaining the qualifying balances in your DFCC Aloka account for months prior to reaching your milestone ,"[[""DFCC Aloka savings account"", ""PRODUCT"", 22, 48],[""DFCC Aloka"", ""PRODUCT"", 170, 180], [""months"", ""DATE"", 193, 199]]","['DFCC Gift Certificates', 'DFCC Aloka savings account']"
The new DFCC Credit Card is embedded with the latest Mastecard PayPass technology that allows you to simply tap and go for purchases,"[[""DFCC Credit Card"", ""PRODUCT"", 8, 24]]","['Mastecard PayPass technology', 'Credit Card', 'DFCC Credit Card']"
Cash Back Calculator Calculate the value of cashback you will be entitled to if you use your DFCC credit card for more than per month,"[[""DFCC"", ""ORG"", 93, 97], [""more than per month"", ""DATE"", 114, 133]]","['DFCC credit card', 'DFCC']"
DFCC Bank has recently comprehensively revamped its Junior Plus children savings account ,"[[""DFCC Bank"", ""ORG"", 0, 9],[""Junior Plus children savings account"",""PRODUCT"",52,88]]","['DFCC Bank', 'children savings', 'Junior Plus children savings account ']"
DFCC Credit Cards CashBack into your DFCC Bank account on every transaction Spend minimum of monthly and be eligible to earn CashBack into your savings or current account or your child DFCC Junior Savings Account ,"[[""DFCC Credit Cards"", ""PRODUCT"", 0, 17], [""DFCC Bank"", ""ORG"", 37, 46],[""monthly"", ""DATE"", 93, 100], [""DFCC Junior Savings"", ""PRODUCT"", 185, 204]]","['CashBack', 'DFCC Junior Savings', 'DFCC Credit Cards']"
DFCC Pinnacle Home Loans,"[[""DFCC Pinnacle Home Loans"",""PRODUCT"",0,24]]","['Home Loans', 'Loans', 'DFCC', 'DFCC Pinnacle', 'DFCC Pinnacle Home Loans']"
The system can be fully integrated to client ERP Enterprise Resource Planner through fullfledged secured direct hosttohost H H channel where encrypted payment instructions can be pulled automatically on to DFCC iConnect ,"[[""Enterprise Resource Planner"", ""PRODUCT"", 49, 76], [""DFCC iConnect"", ""PRODUCT"", 206, 219]]","['encrypted payment', 'Enterprise Resource Planner','ERP', 'DFCC iConnect']"
