Sentence,entities,extracted_keywords
Credit Card Pinnacle World Mastercard Rewards,"[[""Pinnacle World Mastercard Rewards"", ""PRODUCT"", 12, 45]]","['Mastercard Rewards', 'Credit Card', 'Pinnacle World Mastercard Rewards', '', 'World Mastercard']"
Digital Banking Facilities,"[[""Digital Banking Facilities"", ""SERVICE"", 0, 26]]",['Digital Banking']
special loan scheme catering to high networth fixed income earners and self employed professionals,"[[""special loan scheme"",""PRODUCT"",0,19]]","['loan scheme', 'special loan', 'fixed income', 'loan']"
Implementation of SEMS is also required under Principle of the Sustainable Banking,"[[""Principle of the Sustainable Banking"", ""SERVICE"", 46, 82]]","['Sustainable Banking', 'SEMS']"
Spend minimum of monthly and be eligible to earn CashBack into your savings or current account or your child DFCC Junior Savings Account,"[[""monthly"", ""DATE"", 17, 24], [""DFCC Junior Savings"", ""PRODUCT"", 109, 128]]","['Junior Savings', 'DFCC Junior Savings']"
DFCC Bank SEMS which was developed in is implemented by the Sustainability Unit ,"[[""DFCC Bank"", ""ORG"", 0, 9]]","['DFCC Bank', 'Sustainability', 'DFCC']"
Leasing With over decades in the leasing business we at DFCC are fully geared to meet all your leasing requirements,"[[""DFCC"", ""ORG"", 56, 60]]","['leasing requirements', 'DFCC', 'Leasing']"
This feature on iConnect allows clients to get their distributors and suppliers onto one platform for direct financing to be approved by the Bank ,"[[""iConnect"", ""PRODUCT"", 16, 24], [""Bank"", ""ORG"", 141, 145]]","['iConnect', 'direct financing']"
DFCC Salary Plus,"[[""DFCC Salary Plus"",""PRODUCT"",0,16]]","['DFCC Salary Plus', 'Salary', 'DFCC']"
Finance Leasing early Termination Fee On the future capital,"[[""Finance Leasing"",""SERVICE"",0,15]]","['Finance Leasing', 'future capital']"
HDFC Gold Loan,"[[""HDFC Gold Loan"", ""PRODUCT"", 0, 14]]","['Gold Loan', 'HDFC Gold Loan', 'HDFC']"
HDFC MAX Fixed Deposits,"[[""HDFC MAX Fixed Deposits"",""PRODUCT"",0,23]]","['HDFC MAX Fixed Deposits', 'HDFC', 'Fixed  Deposits']"
Sirisara Housing Loan,"[[""Sirisara Housing Loan"", ""PRODUCT"", 0, 21]]","['Housing Loan','Sirisara Housing Loan']"
HDFC Rationale Promote inclusive economic growth by facilitating affordable homeownership and access to essential financial services thereby empowering individuals and families businesses to build wealth improve their financial stability and contribute to the overall economic wellbeing of the community,"[[""HDFC"",""ORG"",0,4]]","['HDFC','economic wellbeing']"
Credit Division Savings,"[[""Credit Division Savings"", ""PRODUCT"", 0, 23]]","['Credit Division Savings', 'Credit', 'Savings']"
we offer the HDFC Thilina Rekawarana Children Investment Plan specially designed to guarantee your child future financial security,"[[""HDFC Thilina Rekawarana Children Investment Plan"", ""PRODUCT"", 13, 61]]","['HDFC Thilina Rekawarana Children Investment Plan', 'Children Investment']"
HDFC Guarantor Loan employed individuals can access funding benefit from reasonable repayment periods and enjoy competitive interest rates Loan Amount Repayment Period,"[[""HDFC Guarantor Loan"", ""PRODUCT"", 0, 19]]","['HDFC Guarantor Loan', 'HDFC']"
HDFC Salary Saver Unique savings solution for monthly income earners is the best option to save some of your hardearned money and ensure brighter future ,"[[""HDFC Salary Saver"", ""PRODUCT"", 0, 17]]","['Unique savings', 'HDFC Salary Saver']"
The Shrama Udana Loan is designed specifically for members of the Employer Provident Fund EPF seeking financial support for your housing needs ,"[[""Shrama Udana Loan"", ""PRODUCT"", 4, 21]]","['Shrama Udana Loan', 'Loan', 'financial support']"
Set for Life is unique wealth creation scheme that empowers you to invest wisely and secure carefree and financially independent future ,"[[""Set for Life"",""PRODUCT"",0,12]]","['wealth creation scheme', 'Set for Life']"
Lanka Money Transfer LMT service for migrant worker remittances HDFC Bank savings account holders living in the middle east countries Israel Qatar UAE Italy UK Australia Japan Kuwait Romania and Hong Kong can remit money through this service,"[[""Lanka Money Transfer"", ""SERVICE"", 0, 20], [""LMT"", ""SERVICE"", 21, 24], [""HDFC Bank"", ""ORG"", 64, 73], [""middle east"", ""GPE"", 112, 123], [""Israel"", ""GPE"", 134, 140], [""Qatar"", ""GPE"", 141, 146], [""Italy"", ""GPE"", 151, 156], [""UK"", ""GPE"", 157, 159], [""Australia"", ""GPE"", 160, 169], [""Japan"", ""GPE"", 170, 175], [""Kuwait"", ""GPE"", 176, 182], [""Romania"", ""GPE"", 183, 190], [""Hong Kong"", ""GPE"", 195, 204]]","['HDFC', 'Money Transfer']"
HDFC Bank Joins With Lankapay just Pay System To Facilitate Hassle Free Transactions Up To Per Transaction Limit For Our prathilabhasavings Account Holders,"[[""HDFC Bank"", ""ORG"", 0, 9]]","['HDFC Bank', 'Free Transactions', 'Lankapay']"
Our Fixed Deposit Accounts provide trusted and convenient way to grow your hardearned money with competitive interest rates and flexible periods With HDFC ,"[[""Fixed Deposit"", ""PRODUCT"", 4, 17]]","['Fixed Deposit', 'Deposit Accounts', 'HDFC']"
Online Banking Just Pay Enabled Mobile Apps HDFC Bank Joins With Lankapay just Pay System To Facilitate Hassle Free Transactions Up To Per Transaction Limit For Our Prathilabha Savings Account Holders ,"[[""Online Banking"", ""SERVICE"", 0, 14],[""HDFC Bank"", ""ORG"", 44, 53],[""LankaPay"", ""ORG"", 65, 73],[""Prathilabha Savings"", ""PRODUCT"", 165, 184]]","['Online Banking', 'Free Transactions', 'HDFC Bank', 'Prathilabha Savings', 'LankaPay']"
Debit Card Discover range of debit card exclusive features and benefits Lanka Money Transfer LMT HDFC bank Prathilabha savings account holders can now remit money on real time through this service,"[[""Debit Card"", ""PRODUCT"", 0, 10], [""Lanka Money Transfer"", ""SERVICE"", 72, 92], [""LMT"", ""SERVICE"", 93, 96], [""HDFC bank"", ""ORG"", 97, 106], [""Prathilabha savings"", ""PRODUCT"", 107, 126]]","['Debit Card', 'Prathilabha savings account', 'savings account','Lanka Money Transfer', 'LMT']"
Welcome to HDFC Bank where dreams find their foundation aspirations are nurtured and opportunities are embraced,"[[""HDFC Bank"", ""ORG"", 11, 20]]","['foundation aspirations', 'HDFC Bank']"
HDFC Arumbu is uniquely designed Investment Plan offered for the Tamil speaking community in Sri Lanka aimed at guaranteeing your child financial security ,"[[""HDFC Arumbu"", ""PRODUCT"", 0, 11], [""Sri Lanka"", ""GPE"", 93, 102]]","['Investment Plan', 'HDFC Arumbu']"
HDFC Gold Loans allow customers to leverage their gold assets to obtain funds for shortterm needs including financial emergencies With our low rate of interest highest advance amount and maximum security for your valuable gold ,"[[""HDFC Gold Loans"", ""PRODUCT"", 0, 15]]","['Gold Loans', 'HDFC Gold', 'Loans']"
HDFC maintains Central Bank recommended Baseline security standards which acts as control mechanism against cyber related incidents and threats ,"[[""HDFC"", ""ORG"", 0, 4], [""Central Bank"", ""ORG"", 15, 27]]","['security standards', 'Baseline security', 'security', 'HDFC', 'Central Bank']"
HDFC Bank of Sri Lanka being responsible corporate citizen is committed to conduct business in manner consistent with the corporate vision and mission with environmental stewardship and social progress,"[[""HDFC Bank of Sri Lanka"", ""ORG"", 0, 22]]","['HDFC Bank of Sri Lanka', 'corporate citizen', 'corporate vision', 'corporate']"
FD Investment plan Our Fixed Deposit Accounts provide trusted and convenient way to grow your hardearned money with competitive interest rates and flexible tenures,"[[""FD Investment"", ""PRODUCT"", 0, 13], [""Fixed Deposit Accounts"", ""PRODUCT"", 23, 45]]","['Fixed Deposit', 'FD', 'Investment plan']"
HDFC Smart Goal is unique savings scheme designed to enable you to realize your mediumterm goals Whether it purchasing new car getting married or sending your children overseas for education ,"[[""HDFC Smart Goal"", ""PRODUCT"", 0, 15]]","['HDFC Smart', 'HDFC Smart Goal', 'savings scheme', 'HDFC']"
HDFC Education Loan,"[[""HDFC Education Loan"", ""PRODUCT"", 0, 19]]","['HDFC Education Loan', 'Education Loan', 'HDFC', 'Education']"
Our Fixed Deposit Accounts provide trusted and convenient way to grow your hardearned money with competitive interest rates and flexible tenures ,"[[""Fixed Deposit Accounts"", ""PRODUCT"", 4, 26]]","['Deposit Accounts', 'Fixed Deposit','HDFC']"
Kedella Housing Loan,"[[""Kedella Housing Loan"", ""PRODUCT"", 0, 20]]","['Housing Loan', 'Kedella Housing Loan']"
HDFC Vishrama Rekawarana is our unique Retirement Fund customized financial instrument that caters to the special needs of social clusters such as the Agricultural Farming community Government Teachers community and nongovernmental industrial workers community ,"[[""HDFC Vishrama Rekawarana"", ""PRODUCT"", 0, 24]]","['Retirement Fund', 'HDFC Vishrama Rekawarana']"
With the HDFC Max Fixed Deposit Scheme you can choose from selection of tenures that suit your individual and unique investment needs,"[[""HDFC Max Fixed Deposit Scheme"", ""PRODUCT"", 9, 38]]","['Fixed Deposit', 'HDFC Max Fixed Deposit Scheme', 'HDFC']"
HDFC Guarantor Loan,"[[""HDFC Guarantor Loan"", ""PRODUCT"", 0, 19]]","['Guarantor Loan', 'HDFC Guarantor Loan', 'HDFC']"
Lanka Money Transfer LMT service for migrant worker remittances,"[[""Lanka Money Transfer"", ""SERVICE"", 0, 20], [""LMT"", ""SERVICE"", 21, 24]]","['worker remittances','Money Transfer', 'Lanka Money Transfer', 'LMT']"
HDFC Bank joins with lankapay just Pay system to facilitate hassle free transactions,"[[""HDFC Bank"", ""ORG"", 0, 9], [""lankapay"", ""ORG"", 21, 29]]","['HDFC Bank', 'lankapay', 'free transactions', 'HDFC']"
we have designed Thilina Savings Account personalized Investment Account exclusively for children With Thilina you can lay strong foundation for financial wellbeing,"[[""Thilina Savings Account"", ""PRODUCT"", 17, 40]]","['Savings Account', 'Thilina Savings Account', 'Investment Account']"
Our Fixed Deposit Accounts provide trusted and convenient way to grow your hardearned money with competitive interest rates and flexible periods ,"[[""Fixed Deposit Accounts"", ""PRODUCT"", 4, 26]]","['Deposit Accounts', 'Fixed Deposit']"
Gurusevana Savings Deposits,"[[""Gurusevana Savings Deposits"", ""PRODUCT"", 0, 27]]","['Gurusevana Savings', 'Deposits', 'Savings']"
EPF Smart Loan,"[[""EPF Smart Loan"", ""PRODUCT"", 0, 14]]","['Smart Loan', 'EPF Smart Loan', 'EPF']"
HDFC Bank savings account holders living in the middle east countries Israel Qatar UAE Italy UK Australia Japan Kuwait Romania and Hong Kong can remit money through this service,"[[""HDFC Bank"", ""ORG"", 0, 9], [""middle east"", ""GPE"", 48, 59], [""Israel"", ""GPE"", 70, 76], [""Qatar"", ""GPE"", 77, 82], [""Italy"", ""GPE"", 87, 92], [""UK"", ""GPE"", 93, 95], [""Australia"", ""GPE"", 96, 105], [""Japan"", ""GPE"", 106, 111], [""Kuwait"", ""GPE"", 112, 118], [""Romania"", ""GPE"", 119, 126], [""Hong Kong"", ""GPE"", 131, 140]]","['HDFC Bank', 'savings account']"
With the HDFC Guarantor Loan employed individuals can access funding benefit from reasonable repayment periods and enjoy competitive interest rates,"[[""HDFC Guarantor Loan"", ""PRODUCT"", 9, 28]]","['Guarantor Loan', 'HDFC Guarantor Loan']"
HDFC Development and Corporate Loan Scheme dedicated to fueling the growth and success of small medium and large enterprises through our transformative Development Loan Scheme,"[[""HDFC Development and Corporate Loan Scheme"", ""PRODUCT"", 0, 42], [""Development Loan Scheme"", ""PRODUCT"", 152, 175]]","['Development Loan', 'Corporate Loan', 'Loan Scheme', 'HDFC']"
Development Credit Mortgage,"[[""Development Credit Mortgage"", ""PRODUCT"", 0, 27]]","['Development', 'Credit Mortgage', 'Development Credit Mortgage']"
Vishrama Udana Fixed Deposits is fixed deposit scheme designed exclusively for Senior Citizens ensuring the safety and growth of your investments,"[[""Vishrama Udana Fixed Deposits"", ""PRODUCT"", 0, 29]]","['fixed deposit', 'deposit scheme', 'Vishrama Udana Fixed Deposit', 'Senior Citizens']"
EPF Advantage Loan,"[[""EPF Advantage Loan"", ""PRODUCT"", 0, 18]]","['Advantage Loan', 'EPF Advantage Loan', 'EPF']"
Kedella Housing loan offers unparalleled flexibility ensuring tailormade financing solution to suit all your housing needs With attractive rates that will leave you smiling ,"[[""Kedella Housing Loan"", ""PRODUCT"", 0, 20]]","['Housing loan', 'Kedella Housing Loan', 'loan offers']"
HDFC Bank recognizes that statutory and financial obligations and equitable partnership as the basic principles used in the process of identifying the stakeholders with whom the Bank is to maintain regular engagement ,"[[""HDFC Bank"", ""ORG"", 0, 9], [""Bank"", ""ORG"", 178, 182]]","['HDFC Bank', 'partnership']"
 We have been recognized for our financial stability and prudent management When you choose HDFC Bank prudent investment plans,"[[""HDFC Bank"", ""ORG"", 92, 101]]","['management', 'HDFC Bank', 'investment']"
HDFC SUSTAINABILITY POLICY Corporate Sustainability CS considers every dimension of corporation as to how it could prosper economically environmentally and socially ,"[[""HDFC"", ""ORG"", 0, 4]]","['Corporate Sustainability', 'HDFC SUSTAINABILITY']"
Who we are At HDFC Bank we are led by singleminded and sincere purpose to uplift and enhance the lives of customers who have placed their trust in us ,"[[""HDFC Bank"", ""ORG"", 14, 23]]",['HDFC Bank']
Janasevana Ayojana Savings,"[[""Janasevana Ayojana Savings"", ""PRODUCT"", 0, 26]]","['Ayojana Savings', 'Janasevana Ayojana Savings']"
PalmTop banking technology has enabled us to expand our service base to grass root level with the use of handheld devices,"[[""PalmTop Banking"", ""SERVICE"", 0, 15]]","['PalmTop banking','banking technology']"
HDFC Prathilaba the right product that suits your requirements and offers the best returns and ease of transactions,"[[""HDFC Prathilaba"", ""PRODUCT"", 0, 15]]","['HDFC Prathilaba', 'HDFC']"
The HDFC Sirisara Loan is designed specifically for the purpose of purchasing home appliances furniture or any other lifestyle enhancement expense allowing you to improve your lifestyle and transform your living space into haven of comfort and elegance,"[[""HDFC Sirisara Loan"", ""PRODUCT"", 4, 22]]","['HDFC', 'HDFC Sirisara Loan']"
Western Union money transfers HDFC Bank savings account holders living in the middle east countries can remit money through this service,"[[""Western Union"", ""ORG"", 0, 13], [""HDFC Bank"", ""ORG"", 30, 39], [""middle east"", ""GPE"", 78, 89]]","['money transfers', 'HDFC Bank', 'Western Union']"
Fixed Deposits rates HDFC Max Deposits Nature of investment Duration Interest Rate At Maturity AER ,"[[""HDFC Max Deposits"", ""PRODUCT"", 21, 38]]","['Deposits rates', 'HDFC Max Deposits', 'investment']"
ATM Transactions Debit Card,"[[""Debit Card"", ""PRODUCT"", 17, 27]]","['Debit Card', 'ATM Transactions', 'ATM', 'Transactions']"
Nivasa Ayojana Savings,"[[""Nivasa Ayojana Savings"", ""PRODUCT"", 0, 22]]","['Ayojana Savings', 'Nivasa Ayojana Savings']"
Gold Loan Advances,"[[""Gold Loan Advances"", ""PRODUCT"", 0, 18]]","['Gold Loan', 'Loan Advances']"
HDFC Bank savings account holders living in the middle east countries can remit money through this service,"[[""HDFC Bank"", ""ORG"", 0, 9], [""middle east"", ""GPE"", 48, 59]]","['HDFC Bank', 'savings account', 'remit money']"
HDFC Bank Sustainability CSR Financials,"[[""HDFC Bank"", ""ORG"", 0, 9]]","['Sustainability', 'CSR Financials', 'HDFC Bank']"
Attractive Fixed Deposit Scheme for senior citizens,"[[""Fixed Deposit Scheme"", ""PRODUCT"", 11, 31]]","['Fixed Deposit Scheme', 'senior citizens']"
Lanka Money Transfer LMT HDFC bank Prathilabha savings account holders can now remit money on real time through this service,"[[""Lanka Money Transfer"", ""SERVICE"", 0, 20], [""LMT"", ""SERVICE"", 21, 24], [""HDFC Bank"", ""ORG"", 25, 34], [""Prathilabha savings account"", ""PRODUCT"", 35, 62]]","['remit money', 'Money Transfer', 'Lanka Money Transfer','LMT','HDFC Bank', 'Prathilabha savings account']"
Kedella Housing Loan Discover the gateway to turning your dreams into reality ,"[[""Kedella Housing Loan"", ""PRODUCT"", 0, 20]]","['Housing Loan', 'Kedella Housing Loan']"
Our meticulously designed savings schemes help you achieve your financial goals with ease,"[[""savings schemes"", ""PRODUCT"", 26, 41]]","['savings schemes','shortterm savings']"
HDFC bank Prathilabha savings account holders can now remit money on real time through this service,"[[""HDFC Bank"", ""ORG"", 0, 9], [""Prathilabha savings account"", ""PRODUCT"", 10, 37]]","['HDFC bank', 'Prathilabha savings account', 'remit money']"
HDFC Thilina Planning for your child financial stability is key to their future growth ,"[[""HDFC Thilina Planning"", ""PRODUCT"", 0, 21]]","['child', 'HDFC Thilina Planning']"
At HDFC we firmly believe that everyone deserves chance to build secure future and own their dream home business or lifestyle ,"[[""HDFC"", ""ORG"", 3, 7]]",['HDFC']
Explore our range of Gold loans designed for your unique needs,"[[""Gold Loans"", ""PRODUCT"", 21, 31]]","['Gold loans','loans']"
Corporate Sustainability CS considers every dimension of corporation as to how it could prosper economically environmentally and socially ,"[[""Corporate Sustainability"", ""SERVICE"", 0, 24]]","['Corporate Sustainability', 'CS', 'Sustainability']"
HDFC philosophy on sustainability is incorporating sustainability Considerations as an integral part of it business and creating balanced longterm benefits for all our stakeholders,"[[""HDFC"", ""ORG"", 0, 4]]","['HDFC', 'sustainability']"
Vishrama Udana Fixed Deposit,"[[""Vishrama Udana Fixed Deposit"", ""PRODUCT"", 0, 28]]","['Fixed Deposit', 'Vishrama Udana Fixed Deposit']"
HDFC Vishrama Rekawarana is our unique Retirement Fund customized financial instrument that caters to the special needs of social clusters such as the Agricultural Farming community Government Teachers community and nongovernmental industrial workers community,"[[""HDFC Vishrama Rekawarana"", ""PRODUCT"", 0, 24]]","['Retirement Fund', 'HDFC', 'HDFC Vishrama Rekawarana']"
Start depositing your salary or minimum of per month into the HDFC Salary Saver account and enjoy host of great benefits,"[[""HDFC Salary Saver"", ""PRODUCT"", 62, 79]]","['HDFC Salary Saver', 'HDFC']"
HDFC Smart Goals,"[[""HDFC Smart Goals"", ""PRODUCT"", 0, 16]]","['HDFC Smart Goals', 'HDFC']"
HDFC Vishrama Rekawarana,"[[""HDFC Vishrama Rekawarana"", ""PRODUCT"", 0, 24]]","['HDFC', 'HDFC Vishrama Rekawarana']"
HDFC Thilina Planning for your child financial stability is key to their future growth That is why we have designed Thilina Savings Account personalized Investment Account exclusively for children ,"[[""HDFC Thilina Planning"", ""PRODUCT"", 0, 21], [""Thilina Savings"", ""PRODUCT"", 116, 131]]","['child', 'HDFC Thilina Planning', 'Thilina Savings', 'Investment Account']"
HDFC Thilina Rekawarana Children Investment Plan specially designed to guarantee your child future financial security ,"[[""HDFC Thilina Rekawarana Children Investment Plan"", ""PRODUCT"", 0, 48]]","['Children Investment', 'HDFC Thilina Rekawarana Children Investment Plan']"
HDFC Salary Saver Unique savings solution for monthly income earners is the best option to save some of your hardearned money and ensure brighter future,"[[""HDFC Salary Saver"", ""PRODUCT"", 0, 17]]","['HDFC', 'HDFC Salary Saver']"
HDFC Bank joins with LankaPay Just Pay system to facilitate hassle free transactions for our Prathilabha savings account holders ,"[[""HDFC Bank"", ""ORG"", 0, 9], [""LankaPay"", ""ORG"", 21, 29], [""Prathilabha savings account"", ""PRODUCT"", 93, 120]]","['HDFC Bank', 'Prathilabha savings account', 'LankaPay']"
HDFC Development and Corporate Loan Scheme,"[[""HDFC Development and Corporate Loan Scheme"", ""PRODUCT"", 0, 42]]","['Corporate Loan', 'HDFC Development and Corporate Loan Scheme','HDFC']"
HDFC Vishrama Udana Fixed Deposits is fixed deposit scheme designed exclusively for Senior Citizens ensuring the safety and growth of your investments,"[[""HDFC Vishrama Udana"", ""PRODUCT"", 0, 19], [""Fixed Deposits"", ""PRODUCT"", 20, 34]]","['HDFC Vishrama Udana', 'deposit scheme', 'Fixed Deposits', 'HDFC']"
HDFC Bank joins with LankaPay Just Pay system to facilitate hassle free transactions for our Prathilabha savings account,"[[""HDFC Bank"", ""ORG"", 0, 9], [""LankaPay"", ""ORG"", 21, 29], [""Prathilabha savings account"", ""PRODUCT"", 93, 120]]","['HDFC Bank', 'Prathilabha savings account', 'LankaPay']"
HDFC Gold Advance allows you to leverage your gold assets to obtain funds for shortterm needs including financial emergencies ,"[[""HDFC Gold Advance"", ""PRODUCT"", 0, 17]]","['HDFC', 'HDFC Gold Advance']"
HDFC Salary Saver,"[[""HDFC Salary Saver"", ""PRODUCT"", 0, 17]]","['HDFC Salary Saver', 'HDFC']"
HDFC Leasing Embark on an extraordinary journey of growth and elevate your possibilities with our unparalleled leasing services,"[[""HDFC Leasing"", ""ORG"", 0, 12]]","['HDFC Leasing','HDFC', 'Leasing']"
Digital HDFC embraced modern technology to keep abreast with development and to best serve its constantly increasing volume of customers ,"[[""Digital HDFC"", ""ORG"", 0, 12]]","['Digital HDFC', 'Digital', 'HDFC']"
Kedella Housing Loan is your ultimate partner for all your housing purposes to achieve your dream home,"[[""Kedella Housing Loan"", ""PRODUCT"", 0, 20]]","['Housing Loan', 'Kedella Housing Loan']"
Savings schemes help you achieve your financial goals with ease offering competitive interest rates and flexible terms to suit your preferences Whether youre looking for shortterm savings or longterm investments we have the right solution for you,"[[""Savings schemes"", ""PRODUCT"", 0, 15]]",['savings schemes']
HDFC Gold Loans allow customers to leverage their gold assets to obtain funds for shortterm needs including financial emergencies ,"[[""HDFC Gold Loans"", ""PRODUCT"", 0, 15]]","['Gold Loans', 'HDFC', 'HDFC Gold Loans']"
Western Union money transfers,"[[""Western Union"", ""ORG"", 0, 13]]","['money transfers', 'Western Union']"
HDFC Thilina Rekawarana,"[[""HDFC Thilina Rekawarana"", ""PRODUCT"", 0, 23]]","['HDFC', 'HDFC Thilina Rekawarana']"
COVID Integrated Homebased Care Solution,"[[""COVID Integrated Homebased Care Solution"", ""PRODUCT"", 0, 40]]",['COVID Integrated Homebased Care Solution']
Green Loans for Personnel Other Sustainable Development Loans ,"[[""Green Loans"", ""PRODUCT"", 0, 11], [""Sustainable Development Loans"", ""PRODUCT"", 32, 61]]","['Green Loans', 'Development Loans', 'Loans', 'Sustainable Development']"
When you make payments from your BOC Debit Card you can choose to deposit money from your expenses ,"[[""BOC Debit Card"", ""PRODUCT"", 33, 47]]","['BOC', 'Debit Card', 'deposit money']"
Ran Surekum Naya Sewa Gold Loan ,"[[""Ran Surekum Naya Sewa Gold Loan"", ""PRODUCT"", 0, 31]]","['Gold Loan', 'Ran Surekum Naya Sewa']"
Foreign Currency Savings Deposits,"[[""Foreign Currency Savings Deposits"", ""PRODUCT"", 0, 33]]","['Currency Savings', 'Savings Deposits', 'Foreign Currency']"
Senior Credit Manager,"[[""Senior Credit Manager"", ""PERSON"", 0, 21]]","['Credit Manager', 'Senior Credit Manager']"
BOC Smartgen Next Generation Savings Account The next generation of savings accounts offers customers wide array of services to enjoy the speed and convenience of banking with Bank of Ceylon Account ," [[""BOC Smartgen Next Generation Savings Account"", ""PRODUCT"", 0, 44], [""Bank of Ceylon"", ""ORG"", 176, 190]]","['Savings Account', 'BOC Smartgen']"
Regular Current Account comes with range of benefits to manage your daytoday transactions either personal or business,"[[""Regular Current Account"", ""PRODUCT"", 0, 23]]","['Current Account', 'transactions']"
This loan scheme is designed to provide financial support to professionals in designated sectors,"[[""loan scheme"", ""PRODUCT"", 5, 16]]","['loan scheme', 'financial support']"
BOC Chairman Kavinda de Zoysa with over years of industry experience and years in management brings leadership and strategic insights to BOC,"[[""BOC Chairman"", ""PERSON"", 0, 12], [""Kavinda de Zoysa"", ""PERSON"", 13, 29]]","['BOC Chairman', 'leadership', 'BOC']"
BOC Kantha Ran Ginum Savings Certificate is lump sum investment option exclusively designed for ladies offering higher return FeaturesFace Value ,"[[""BOC Kantha Ran Ginum Savings"", ""PRODUCT"", 0, 28]]","['Savings', 'BOC Kantha']"
BOC Smart Freelancer ,"[[""BOC Smart Freelancer"", ""PRODUCT"", 0, 20]]","['Smart Freelancer', 'BOC Smart Freelancer', 'BOC']"
BOC Credit Cards,"[[""BOC Credit Cards"", ""PRODUCT"", 0, 16]]","['BOC Credit Cards','BOC']"
BOC Special Credit Cards,"[[""BOC Special Credit Cards"", ""PRODUCT"", 0, 24]]","['Credit Cards', 'BOC', 'BOC Special Credit Cards']"
Master Titanium Card ,"[[""Master Titanium Card"", ""PRODUCT"", 0, 20]]","['Titanium Card', 'Master Titanium Card']"
Visa Platinum Card,"[[""Visa Platinum Card"", ""PRODUCT"", 0, 18]]","['Platinum Card', 'Visa Platinum Card']"
Visa Gold Card ,"[[""Visa Gold Card"", ""PRODUCT"", 0, 14]]","['Visa Gold', 'Gold Card']"
Visa Classic Card ,"[[""Visa Classic Card"", ""PRODUCT"", 0, 17]]","['Visa Classic', 'Classic Card']"
BOC Abhimana Government Pensioners Loan Scheme To empower dynamic workforce for the nation economic development ,"[[""BOC Abhimana Government Pensioners Loan Scheme"", ""PRODUCT"", 0, 46]]","['Pensioners Loan', 'Government Pensioners', 'Loan Scheme', 'BOC Abhimana Government Pensioners Loan Scheme', 'BOC']"
Sustainability Policy Framework of the Bank of Ceylon,"[[""Sustainability Policy Framework"", ""SERVICE"", 0, 31], [""Bank of Ceylon"", ""ORG"", 39, 53]]","['Sustainability', 'Bank of Ceylon']"
